title,background,ad_description,issue,response,assessment,action,url
ASA Ruling on Phlo Technologies Ltd t/a Phlo Clinic,"This Ruling forms part of a wider piece of work on prescription-only medicines (POMs) used for weight loss. The ads were identified for investigation following intelligence gathering by our Active Ad Monitoring system, which uses AI to proactively search for online ads that might break the rules.","A paid-for Google search ad for Phlo Clinic, seen on 2 December 2024, included text that stated, “Weight loss Injections”.",The ASA challenged whether the ad breached the Code because it promoted POMs to the public.,"Phlo Technologies Ltd t/a Phlo Clinic said their telehealth service included a consultation with qualified healthcare professionals, educational resources to empower patient decision-making and treatment options, including both only POM and non-POM items (which were available only when clinically appropriate and following consultation). They believed the marketing of their service was compliant with the guidelines issued by the GPhC (General Pharmaceutical Council) and MHRA (Medicines and Healthcare products Regulatory Agency) and did not promote POMs to the public. They acknowledged that the claim “Weight Loss Injection” could have been misinterpreted as promoting POMs. They said the ad had been dynamically generated and used Google Ads Dynamic Search Ad (DSA) to automatically generate the ad’s headline and description, based on the user’s search term. That had inadvertently resulted in the use of the claim 'Weight Loss Injections' appearing in the text. They said the ad and all associated ads using the DSA format were removed from circulation in December 2024 prior to the start of the ASA’s investigation. They further said that they had implemented advertising changes and updated their advertising strategy, to include a tighter internal review process to ensure all materials aligned with both ASA and regulatory guidelines. Google said DSAs were a type of ‘Google Ads’ campaign which used an advertiser’s website content to target their ads. They said that headlines and landing pages of DSAs were generated using content from the advertiser’s website, and advertisers chose whether or not to use DSAs. They further said that the ad did not comply with their policies, and that the ad had been removed after they were notified of the investigation.","The CAP Code stated that prescription-only medicines (POMs) or prescription-only medical treatments must not be advertised to the public. The ASA understood that all injectable forms of weight-loss medication were POMs. We considered that consumers would have understood the reference to “weight loss injections” in the ad to be a reference to POMs. We sought advice from the Medicines & Healthcare products Regulatory Agency (MHRA). They expressed concern that as weight-loss injections were legally classified as POMs, the use of those terms was likely to lead to a consumer requesting a POM. Therefore, we considered that the ad advertised POMs to the public and concluded that it breached the Code. We welcomed Phlo’s comments that they had implemented advertising changes and tightened their internal review process. The ad breached CAP Code (Edition 12) rule 12.12 (Medicines, medical devices, health-related products and beauty products).",The ad must not appear again in the form complained of. We told Phlo Technologies Ltd t/a Phlo Clinic not to promote POMs to the public in future.,https://www.asa.org.uk/rulings/phlo-technologies-ltd-a24-1272394-phlo-technologies-ltd.html
ASA Ruling on SemaPen Ltd,"This Ruling forms part of a wider piece of work on prescription-only medicines (POMs) used for weight loss. The ads were identified for investigation following intelligence gathering by our Active Ad Monitoring system, which uses AI to proactively search for online ads that might break the rules.","A paid-for Google ad for SemaPen, seen on 2 October 2024, stated, “SemaPen Weight Loss […] Clinically Designed Weight Loss Pen Program […] SemaPen Makes Weight Loss Easier.”",The ASA challenged whether the ad breached the Code because it promoted POMs to the public.,"SemaPen Ltd said they had initiated an internal review upon being made aware of the complaint. They accepted that the ad in question had not been compliant with the requirements of ASA guidance or the CAP Code. They said they had contracted with a third-party marketing agency and had not realised that the content in question had not been compliant. They said they had shared guidelines issued by the MHRA (Medicines and Healthcare products Regulatory Agency) with the agency at the start of their relationship and had expected that all ads would meet those requirements. SemaPen accepted that they bore the responsibility for their marketing material’s overall compliance and said they had since stopped working with the third-party agency. They had ensured the new agency they were partnering with were aware of the legal and regulatory requirements around the advertising of POMs and had also re-shared MHRA guidance internally. SemaPen said that they were not affiliated with non-specialist prescribers (e.g., GPs), but that they hoped in future to work with the NHS as they grew as a business. They said their website and onboarding process made clear to all patients that not everyone was suitable for prescription-only weight-loss medication, and that patients underwent a thorough medical assessment and triage prior to any prescription being issued. SemaPen said they were happy to work with the ASA on such issues and would ensure that future marketing materials would be compliant.","The CAP Code stated that prescription-only medicines (POMs) or prescription-only medical treatments must not be advertised to the public. The ad included multiple references to the brand name “SemaPen” and the claims “Clinically Designed Weight Loss Pen Program” and “SemaPen Makes Weight Loss Easier”. The ASA considered that the reference to “Weight Loss Pen” was likely to be understood by consumers to mean injectable weight-loss medication. We noted that the landing page on SemaPen’s website which was linked to by the ad stated, “What’s included? Weight Loss Injections […] One of the first providers of weight loss jabs in the UK, we offer this ground breaking [sic] injectable treatment”, next to which was a graphic of a medical injection pen. We understood that all injectable forms of weight-loss medication were POMs. We therefore considered that the reference to “Weight Loss Pen” in the ad promoted a POM to the public. Furthermore, “SemaPen” the brand name of the product, which was referenced in the ad, was made up of a combination of the terms “Sema” and “Pen”. We considered that, in the context of an ad for a weight-loss treatment, consumers would be likely to understand the reference to “Sema” to be an abbreviated version of “semaglutide”, which was a weight-loss POM. We therefore considered that the references to “Sema” and “SemaPen” promoted a POM to the public. We sought advice from the Medicines & Healthcare products Regulatory Agency (MHRA). They expressed concern that as weight-loss injections (“Weight Loss Pen”) were legally classified as a POM, the use of that term was likely to lead to a consumer requesting a POM. While we welcomed SemaPen’s assurances that future ads would be compliant with the requirements of the Code, for the above reasons we considered that the ad had advertised POMs to the public and concluded that it breached the Code. The ad breached CAP Code (Edition 12) rule 12.12 (Medicines, medical devices, health-related products and beauty products).",The ad must not appear again in the form complained of. We told SemaPen Ltd not to promote POMs to the public in future.,https://www.asa.org.uk/rulings/semapen-ltd-a24-1264772-semapen-ltd.html
ASA Ruling on Yazen Health AB t/a Yazen,This Ruling forms part of a wider piece of work on prescription-only medicines (POMs) used for weight loss.,"An Instagram post by the TV personality Gemma Collins, @gemmacollins, posted on 6 January 2025, promoted the weight loss service Yazen. In a video, Ms Collins stated, “I'm starting this year two sizes down, thanks to Yazen’s weight loss app and medication. It's really quick and easy to get started with Yazen, it has absolutely changed my life […] I finally found something that actually I lose weight on. All you need to do is download the app and answer a few quick questions about your goals. Do not buy it from anyone but Yazen.” Ms Collins stated, “I feel healthier, I feel happier. I don't have that constant noise in my head ‘you need to eat, you need to eat’ […] Yes, there's, you know, reports and stuff. And I'm not telling anyone to go on this medication, but it is prescribed on the NHS.” Ms Collins then stated, “Yazen will connect you with one of their nurses who will […] complete some simple health checks and a blood test […] your Yazen doctor will use this to create your individual treatment plan and just like that, your medication will be delivered straight to your door with all the instructions on how you need to start your weight loss journey. It really is as simple as that.” Text in the accompanying caption stated, “Yazen was founded by doctors to support people struggling with obesity and weight-related issues. They use approved medication alongside support from their team of doctors, psychologists, dietitians, physiotherapists and your own Yazen Coach, helping their patients take control of their health […] I hope we can all embark on this journey together. It’s important to remember everyone’s weight loss journey is personal and unique and you can talk to your GP if you’re concerned! Visit @yazenUK to find out more. #Yazen #YazenHealth #weightlossjourney #healthylifestyle #loseweightnow”.",Two complainants challenged whether the ad breached the Code because it promoted POMs to the public.,"Yazen Health AB t/a Yazen said they were a Swedish-registered digital healthcare provider focused on treating weight issues and obesity through their digital platform, which had been developed by a specialist team of healthcare professionals. They said their method was built on clinically proven science, where every patient received a personal assessment and an individually adapted treatment plan. That plan included support from doctors, lifestyle coaches, dietitians, psychologists and physiotherapists. As part of the treatment, the doctor might prescribe relevant medication, which meant that Yazen was a digital healthcare provider, not a pharmacy. Doctors employed by Yazen might prescribe POMs as part of patient treatment if it was found to be the best option for that individual. The patient would then purchase the medication from a pharmacy of their choice. Yazen did not sell any medication, and said their business model was not dependent on prescribing such medication. Therefore, they said they had no interest in advertising POMs to the public. Yazen said the paid partnership Instagram post from 6 January had been intended to share information about their holistic, responsible approach to weight loss, and had not been intended to focus solely on medication. Following notification of the complaint, and in agreement with Gemma Collins, the post had since been amended to remove any reference to POMs. Yazen said they would ensure that future posts were compliant with the CAP Code. Gemma Collins said she took her responsibilities under the CAP code seriously and strove to comply with them. She said she had partnered with Yazen as she had historically struggled with her weight, despite trying many diets. She said she had used Yazen's for several months before deciding to go public with it, because she found the programme had worked for her. She said it was the holistic approach which had helped her and which she wanted to share primarily. She said she would have done that regardless of whether medication was recommended. She accepted that her posts had promoted the Yazen weight loss service and app. She said Yazen would in future approve any marketing materials she might post, and that she would follow any guidance the ASA provided.","The CAP Code stated that prescription-only medicines (POMs) or prescription-only medical treatments must not be advertised to the public. The ASA acknowledged that the ad did not make reference to a named POM. However, the ad did refer to “weight loss […] medication” and “it is prescribed on the NHS”. Ms Collins also stated, “Yes, there's […] reports and stuff. And I'm not telling anyone to go on this medication, but it is prescribed on the NHS” which we considered, given her tone, alluded to the recent press reports that people had suffered adverse reactions from taking injectable weight-loss medications. We also noted that a news section on Yazen’s website featured links to three newspaper articles about Ms Collins’ weight-loss journey. The thumbnails for those articles featured text explaining that Ms Collins had lost weight using Yazen’s “GLP-1 weight loss injections”. We understood that all injectable forms of weight-loss medication were POMs and that GLP-1 (glucagon-like peptide-1) were a class of POMs. We sought advice from the Medicines & Healthcare products Regulatory Agency (MHRA). They expressed concern that consumers were likely to be led to request a POM. It was their view that this likelihood could be amplified by any resultant national newspaper coverage of Ms Collins’ experience of using a GLP-1 medicinal product for weight loss. We considered that the reference to “weight loss medication” in the ad was a reference to POMs and that the ad therefore promoted POMs to the public. For those reasons, we concluded the ad breached the Code. The ad breached CAP Code (Edition 12) rule 12.12 (Medicines, medical devices, health-related products and beauty products).","The ad must not appear again in the form complained of. We told Yazen Health AB t/a Yazen not to promote, either directly or indirectly, POMs to the public in future.",https://www.asa.org.uk/rulings/yazen-health-ab-g25-1278617-yazen-health-ab.html
ASA Ruling on Cosmos Oyun Yazilim Sanayi Ticaret Ltd Sirketi t/a Filter AI,,"An in-game ad for an AI simulator app, seen on April 6 2025, featured an image of a man alongside text stating, “me”, next to an image of the singer Sabrina Carpenter alongside text stating, “My crush”. An AI simulated video showed the two kissing and text stated, “Kiss your CELEBRITY CRUSH”. A voiceover stated, “Just upload two photos to filter AI app and it will create a video of kissing your celebrity crush in seconds.” Further text stated, “Filter AI. No #1 AI Video Generator. Try with your own photo”.","The complainant, who believed that the ad objectified women, challenged whether it was offensive and promoted a harmful gender stereotype.",Cosmos Oyun Yazilim Sanayi Ticaret Ltd Sirketi t/a Filter AI said they did not intend for the ad to objectify women or to promote a harmful gender stereotype. They said the purpose of the ad was to promote their product in a creative and responsible manner. They said they would review their internal advertising guidelines and confirmed that the ad had been withdrawn.,"The CAP Code stated that ads must be prepared with a sense of responsibility to consumers and to society, must not cause serious or widespread offence and must not include gender stereotypes that were likely to cause harm. The ad featured an AI simulated video in which a man and the singer Sabrina Carpenter were seen to kiss each other, alongside text which stated, “Kiss your celebrity crush”. That video was generated by uploading two images of individual people. The ASA considered that, within the context of the man being labelled “me” and the woman being labelled “My Crush”, the woman was portrayed as being a person who the man was physically attracted to. She was then seen kissing the man, which was her sole role in the ad. Because her only purpose in the ad was entirely focused on being a person for the man to kiss, which was an intimate act, we considered she was reduced to being presented as an object. We therefore considered the ad objectified women and featured a harmful gender stereotype. We also considered the phrase “Just upload two photos to filter AI app and it will create a video of kissing your celebrity crush in seconds” alongside images of women, was both harmful and offensive to women because it implied consumers should use the app to objectify them. We therefore considered the phrase, alongside a selection of images of women, reinforced the harmful impression that it was acceptable to objectify and stereotype women by presenting them as objects. For those reasons, we considered the ad objectified women by reducing them to physical objects. We therefore concluded that the ad included a harmful gender stereotype and was likely to cause serious offence. The ad breached CAP Code (Edition 12) rules 1.3 (Social responsibility), 4.1 and 4.9 (Harm and offence).","The ad must not appear again in the form complained of. We told Cosmos Oyun Yazilim Sanayi Ticaret Ltd Sirketi t/a Filter AI to ensure that future ads were socially responsible and did not cause serious offence, including by featuring a harmful gender stereotype that objectified women.",https://www.asa.org.uk/rulings/cosmos-oyun-yazilim-sanayi-ticaret-ltd-sirketi.html
ASA Ruling on GTOHero Ltd t/a GTO Hero,"On 7 April 2025, the Advertising Codes were updated to reflect the revocation and restatement of the Consumer Protection from Unfair Trading Regulations 2008 (CPRs – the legislation from which the majority of the CAP and BCAP rules on misleading advertising derived) by the Unfair Commercial Practices provisions in the Digital Markets, Competition and Consumers Act 2024 (DMCCA). On that date, the wording of a number of the rules in the Advertising Codes was changed to reflect relevant changes introduced by the DMCCA on 6 April 2025. Given that the complaint that formed the subject of this ruling was received before 7 April 2025, the ASA considered the ad and complaint under the wording of the rules that existed prior to 7 April 2025, and the Ruling (and references to rules within it) should therefore be read in line with this wording, available here – CAP Code and BCAP Code .","A paid-for Reddit ad for GTOHero.com, a poker Real Time Assistance (RTA) app, seen on 14 January 2025. Text stated, “AI is changing poker forever [robot emoji] Don’t get left behind. Stay ahead of the game with GTO Hero’s Real Time Assistance (RTA) [bar graph emoji] Master GTO strategy, Plug leaks, and Outplay opponents using the same technology Pros rely on . [sic] Adapt or Get Crushed!”. A video demonstrated the product in use during an online poker game with other players staking dollars, as a voiceover stated, “This app gives you real time poker solutions. It tracks your game and then tells you what to do so that you can play GTO, making money from poker has never been so easy. You don't even need to download anything, and it's free to access every time it's your turn to act. The GTO solution is immediately shown so that you know what to do. And it's so easy to use. Just go to gtohero.com, share your screen and get real time GTO advice. Find out more at GTO hero com.” The ad linked to a website, GTOHero.com, that stated, “Please note it is against our terms of service to use GTO Hero during live play or in a way that breaks your contract or terms of service with a poker site”.","The complainant, who understood that use of the product was prohibited on poker sites, challenged whether the ad was misleading.","GTOHero Ltd t/a GTO Hero said their product was a service that could track a video feed of an online poker game and display the relevant GTO (Game Theory Optimal) solution. GTO solutions were a form of data that provided a strategy for how to play poker and allowed users to playback video or screen share to compare their play to the GTO in order to study the strategy. They said that looking at GTO solutions during live play did not constitute cheating because it was not deceptive, did not give an unfair advantage or interfere with the game’s integrity. While some poker sites had chosen to ban GTO as a matter of policy, that was a site-specific restriction rather than an inherent violation of the rules of poker. Therefore, it was possible to use GTO “live” in a way that was acceptable. For example, the user may have played on a poker site that allowed players to look up strategies and use their product, the user may not have been playing for real money or the user may have been playing in a simulated game against a computer. GTO Hero said their website homepage, which was the landing page for the ad, had a warning that stated not to use their service during live play or in a way that was not allowed by a specific poker site. They said in addition to that most of the ad showed their product being used on an uploaded video and was not live. Finally, nowhere in the ad did it say it could be used during live play without consequence if it was forbidden by a specific poker site.","The CAP Code stated that marketing communications must not materially mislead or be likely to do so. In addition, marketing communications must state significant limitations and qualifications. Qualifications may clarify but must not contradict the claims that they qualify. We understood that GTO Hero was a poker app that allowed users to use RTA to automatically receive GTO solutions during live play. We also understood that the software showed where, from a video recording of a past game, a player had made a less optimal move and could therefore be used as a learning tool. We acknowledged GTO Hero’s comments that the ad showed their product being used on an uploaded video that was not live and we noted that it was possible to use it in a live setting in a way that was legitimate. For instance, in circumstances where users were not playing for money, where they were playing a computer opponent or on some poker sites that allowed the product. However, we firstly considered it was not clear the ad was an uploaded video. In addition, both the text in the body of the ad and the voiceover in the video stated “Real Time Assistance” or “real time poker solutions”. The video also appeared to show the app being used during a live game with other players staking real dollars around a table, while the voiceover stated, “[The software] gives you real time poker solutions. Tracks your games and tells you what to do, so that you can play GTO. Making money from poker has never been so easy.” We considered consumers were likely to understand the ad to mean that the app was for general use during real-life live events, on a range of platforms, where real funds were being staked. However, in contrast, we understood some poker sites had chosen to ban the use of GTO during live play, potentially resulting in users being banned from platforms and having funds confiscated. We acknowledged that the landing page for the ad had a warning not to use the service during live play or in a way that was not allowed by a poker site. However, we considered that warning, which was in small text and not displayed prominently, in any case misleadingly contradicted the impression of the ad. Because the ad presented the product as being used generally during live poker games to make money, whereas using the app on at least some poker sites during live play was not allowed, we concluded it was misleading. The ad breached CAP Code (Edition 12) rules 3.1 and 3.9 (Misleading advertising).",The ad must not appear again in the form complained of. We told GTOHero Ltd t/a GTO Hero to ensure that future ads did not misleadingly suggest the product could legitimately be used during live play on sites that prohibited the use of GTO solutions during live play.,https://www.asa.org.uk/rulings/gtohero-ltd-a25-1275239-gtohero-ltd.html
