title,background,ad_description,issue,response,assessment,action,url
ASA Ruling on ThruDark Ltd,"Summary of Council decision: Two issues were investigated, both of which were Upheld.","An Instagram post from clothing retailer ThruDark, posted 18 July 2023, featured a video that began with a human-shaped figure wearing a hooded pink coat, seen at a distance standing against one of three wooden frames in front of an earth bank in a field. A person wearing a black hooded coat stepped into view close to the camera, pulled out a semi-automatic rifle and began shooting at the pink-coated figure. Slow motion close-ups showed bullet holes appearing in the coat. The black-hooded individual walked whilst firing, towards the pink-coated figure, changing magazines before pulling out a pistol and continuing to fire. A close-up of the pink-coated figure revealed that it was a mannequin. Further shots destroyed the mannequin’s head while a short scream was heard. The black-hooded individual walked away, towards a building with a corrugated iron roof, showing the ThruDark logo on the back of the coat. They then turned back, pulled out a shotgun that was hidden under the coat and began firing again. Large holes appeared in the mannequin’s head and torso and its head fell off. The black-hooded individual finally walked away and the video cut to a black screen with the text “There can be only one”, followed by ThruDark’s logo. Throughout the ad, classical music was played in the background. The video’s caption stated “‘There can be only one.’ #shroud #thrudark #endeavourthroughadversity”.","The ASA received 11 complaints. 1. The complainants, who believed the ad implied the pink-coated figure was female and the black-coated figured was male, challenged whether the ad was irresponsible, offensive and condoned and encouraged violence, particularly against women. 2. Some of the complainants challenged whether the ad was also irresponsible because it glamourised guns and gun violence.","1. & 2. ThruDark Ltd said they had a proud military heritage and had shown weaponry in previous brand communications and content as a reference to their background. They had established themselves as a brand that was known for their tongue-in-cheek humour and disruptive messaging. They said the ad’s scenario was filmed in good humour and had comedic intention. They had used classical music by Chopin in the background, which they specifically chose to soften and mock the crude nature of the scenario. Additionally, they had used the “Wilhelm scream” stock sound, an inside joke among sound designers, for slapstick comedic effect. They considered that the “Wilhelm scream” was particularly illustrative of the humorous nature of the ad. Some aspects were filmed in slow motion to lessen the sense of realism and heighten the slapstick tone, which was intended to parody the glamorisation of violence frequently shown on television. They considered it was clear from the beginning of the ad that the pink-coated figure was a mannequin. They said it was male in form and did not have feminine facial features, as shown in a “behind the scenes” video shared by a co-founder. They considered that if viewers believed the mannequin was female because it was wearing a pink changing robe, that belief was rooted in the viewer’s own prejudices. They said they had taken positions against the “shrink it and pink it” culture shown by other brands and pointed to previous posts in which they questioned why womenswear was equated with the colour pink. They had used the colour pink because that was the most radical visual departure from their signature black branding and it was the first, brightest-coloured robe they had to hand. They had consistently spoken out against brightly coloured clothing given their background in night operations as part of elite military units. They also did not consider that the black robe would be assumed to indicate the male gender. In the context of the music, comedy sound effects and slow motion, the contrast in the colour of the robes portrayed a fantastical battle between light and dark. The slogan “There can only be one” was a clear reference to the changing robe comparison. It also referenced the cult 1980s fantasy film Highlander, reinforcing the sense of fantastical battle. On the use of guns during the ad, they stated that the simple presence of a gun was not, in and of itself, evidence of a particular stance on gun usage. They said ads for violent action films, children’s toy guns and clay pigeon shooting were permissible on social media platforms. They considered the presence of weapons in the ad was in keeping with their brand’s military heritage and identity. They said that the ad was not irresponsible, because the actions took place in a secure firing range by a highly trained former UK Special Forces operator, and the use of an inanimate object minimised any potential risk of harm. They considered that it was clear that the location was a firing range and not a field because of the target stations, sand bank and covered firing positions. They also said that public disclaimers were messaged at the time. They believed it was not relevant that the firearms used were semi-automatic, but highlighted that the use of semi-automatic weapons would typically be considered to be less extreme than the use of automatic weapons.The ad did not include any form of encouragement or incitement of violence against minority groups, or anti-social behaviour. The ad was in line with their military heritage and was overall well received by the 350,000 people who had viewed it. In their view, the 11 complaints reflected the internalised biases of the complainants and did not evidence that the ad caused serious or widespread offence or was irresponsible. Meta said that they investigated the matter and had restricted the ad from appearing in the United Kingdom.","1. Upheld The CAP Code stated that marketing communications must be prepared with a sense of responsibility to consumers and to society. It further stated that marketing communications must not contain anything that was likely to cause serious or widespread offence and that particular care must be taken to avoid causing offence on the grounds of race, religion, gender, sexual orientation, disability or age. The ad depicted a black-hooded figure repeatedly shooting at a figure wearing a pink coat. The ASA noted that the distinctive colouring of its coat was particularly prominent against the otherwise gloomy colour-scheme. While we agreed that colours were not inherently gendered, we considered that pink was culturally associated with femininity in the UK. In that context, we considered that the simplistic imagery of the stark contrast between the black and pink figures visually alluded to the figures being, respectively, male and female. A close-up of the mannequin’s delicate facial features, which when surrounded by the pink hood we considered would be read as feminine, further enhanced this contrast with the black-hooded figure. We considered that viewers would interpret the ad as alluding to a man shooting and killing a woman or as practising and preparing for a similar scenario. We considered that the ad glamorised and condoned that scenario and was unlikely to be understood as a parody. Rather than suggesting a comedic tone, we considered the use of gentle classical music, with slow-motion emphasis on the damage inflicted on the mannequin, added an eerie tone to the ad. We also considered only a small proportion of the ad’s audience were likely to recognise the “Wilhem scream” and be aware of its background. We therefore concluded that the ad was likely to cause serious and widespread offence, that it condoned and encouraged violence against women, and was irresponsible. On that point the ad breached CAP Code (Edition 12) rules 1.3 (Social responsibility), 4.1 and 4.4 (Harm and offence). 2. Upheld We understood the ad was intended to promote the changing robe worn by the black-hooded figure. We further understood that ThruDark had a military legacy as its founders had previously served in the UK Special Forces. While the ad was set in an outdoor environment and the brand was focused on outdoor clothing, we understood that the guns shown in the ad were not equipment which would typically be used for sport or legal hunting in the UK. We therefore considered that, in the context of an ad from a clothing retailer for outerwear, the presence of three semi-automatic firearms was incongruous and jarring. Throughout the ad, the black-hooded figure repeatedly fired at the mannequin using a semi-automatic rifle, pistol and shotgun, until its head fell off. We considered that the particular weapons used, and the relentless shooting at the target, displayed an extreme level of violence which, as referenced above, would not be interpreted as a comedic parody. Although we accepted that the inclusion of a gun in an ad would not always be irresponsible, we considered that the use of multiple guns (and the particular weapons used), in an ad which promoted an item of outerwear, together with the focus on the guns’ destructive capacity and the added emphasis of the slow-motion effect, glamorised guns and gun violence. We therefore concluded that the ad irresponsibly glamorised guns and condoned gun violence and was in breach of the Code. On that point the ad breached CAP Code (Edition 12) rules 1.3 (Social responsibility) and 4.4 (Harm and offence).","The ad must not appear again in the form complained about. We told ThruDark Ltd to ensure that their ads were socially responsible, did not cause serious or widespread offence, and did not condone and encourage violence, particularly against women. We also told them not to glamorise guns and gun violence in their advertising.",https://www.asa.org.uk/rulings/thrudark-ltd-g23-1206049-thrudark-ltd.html
ASA Ruling on Alibaba.com Singapore E-commerce Private Ltd t/a Alibaba.com,,"A paid-for ad for Alibaba.com, an e-commerce platform, seen on the Daily Mail website on 28 April 2023, featured an image of a doll that took the form of a naked infant with an open mouth and realistic-looking female genitalia. The image appeared alongside two others that depicted a memory stick with a gun-shaped holder, and a lacy thong.","The complainant challenged whether the ad portrayed an infant in a sexualised way and was harmful, offensive and irresponsible.","Alibaba.com Singapore E-commerce Private Ltd t/a Alibaba.com stated that the product in question was a nursing mannequin and that they were aware of its sale on other e-commerce platforms. Nonetheless, they recognised the risk of the ad causing confusion or disturbance to certain audiences. They stated that the ad had potentially been placed on their behalf by a third-party ad network that generated and displayed ads on other websites via the algorithmically driven selection of product listings on their site. They provided some further detail about the mechanisms through which the ad might have appeared, although they were not able to be certain given they could not identify the specific page to which the ad directed visitors. They explained that the advertised product had been listed on their platform by a third-party seller and that they were not otherwise involved in its sale or manufacture. Upon receipt of the complaint, they removed the listing from their platform in order to enforce their own policies, which included that product listings on their platform must not feature images of genitalia. They added that their procedures included random spot-checks to ensure the compliance of approved listings. Associated Newspapers Ltd t/a Daily Mail, the ad’s publisher, stated that the ad was served on their website programmatically. They noted that, before serving ads on their website, some ad networks implemented an automated scanning process that aimed to ensure compliance. However, not all the ad networks responsible for their website’s advertising content offered that functionality. After receipt of the complaint, they took steps to prevent the ad reappearing on their site and added Alibaba.com to their list of blocked advertisers. They confirmed that no readers had complained to them directly.","Upheld The ad featured an image of a doll that took the form of a naked infant with spread legs, an open mouth, and realistic-looking female genitalia, but did not provide any information regarding the product’s function. The image appeared alongside two others depicting a memory stick with a gun-shaped holder and a lacy thong. The ASA understood that the advertised product was an infant nursing mannequin specifically designed for medical training. However, we considered that, in general, consumers would be unfamiliar with such mannequins. We considered that, in the context of a news website, consumers would not expect to served ads for medical training devices that depicted infants’ genitalia. Because of that, we considered that there was a high risk of consumers receiving the impression that the advertised product was a sex doll in the form of an infant. We further considered that impression was likely to be reinforced by the image’s juxtaposition with images of other products that had connotations of sex and violence. We concluded that the ad represented children in a sexualised way, was socially irresponsible, and likely to cause serious and widespread offence. The ad breached CAP Code (Edition 12) rules 1.3 (Social responsibility), 4.1 and 4.8 (Harm and offence).","The ad must not appear in again in the form complained of. We told Alibaba.com Singapore E-commerce Private Ltd t/a Alibaba.com to ensure that their future ads were socially responsible, did not cause serious or widespread offence, or include images that portrayed or represented anyone who was, or seemed to be, under 18 years of age in a sexual manner.",https://www.asa.org.uk/rulings/alibaba-com-singapore-e-commerce-private-ltd-a23-1196361-alibaba-com-singapore-e-commerce-private-ltd.html
ASA Ruling on Tonic Nutrition Ltd t/a Tonic Health,"On 7 April 2025, the Advertising Codes were updated to reflect the revocation and restatement of the Consumer Protection from Unfair Trading Regulations 2008 (CPRs – the legislation from which the majority of the CAP and BCAP rules on misleading advertising derived) by the Unfair Commercial Practices provisions in the Digital Markets, Competition and Consumers Act 2024 (DMCCA). On that date, the wording of a number of the rules in the Advertising Codes was changed to reflect relevant changes introduced by the DMCCA on 6 April 2025. Given that the complaint that formed the subject of this ruling was received before 7 April 2025, the ASA considered the ads and complaint under the wording of the rules that existed prior to 7 April 2025, and the Ruling (and references to rules within it) should therefore be read in line with this wording, available here – CAP Code and BCAP Code . Summary of Council decision: Two issues were investigated, both of which were Upheld.","A website review page and an Instagram reel for Tonic Health, seen on 22 October 2024: a. The product review page on the Tonic Health website, www.tonichealth.co, contained testimonials from customers consisting of a star rating, customer name, title and a brief review. b. The Instagram reel, on Tonic Health’s account @tonichealth, entitled “THE BEST SLEEP SUPPLEMENT ON THE MARKET” promoted the “Rest & Recover Effervescent tablet”. It featured a video of a man in the supplements aisle of a supermarket who stated, “Are you struggling with sleep? Well, I’ve got just the thing for you […] Tonic have just launched our Rest & Recover, which is over 300 mg of bioavailable magnesium along with ashwagandha and lemon balm.” Nutritional information for the product appeared on-screen. The caption stated, “Struggling with sleep? I’ve got just the thing to help Introducing Tonic Rest & Recover Our new 4-in1 effervescent designed to support your sleep and recovery With a soothing cherry flavour, each effervescent blends 300mg of essential magnesium, 100mg of KSM-^^ Ashwagandha, and 500mg of calming lemon balm. This powerhouse combination helps ease stress, improve sleep, and support muscle recovery so you can wake up refreshed and ready for the [closing text cut off]”.",,"1. Tonic Nutrition Ltd t/a Tonic Health acknowledged that duplicated testimonials had appeared under different customer names. They said that was due to a technical error which had now been fully rectified. They said they had removed the testimonials in question and were implementing stricter internal processes in order to check all reviews and to ensure that there were no further errors of that type. 2. Tonic Health said they recognised that the claims “THE BEST SLEEP SUPPLEMENT ON THE MARKET” and “Are you struggling with sleep?” required substantiation through the Great Britain Nutrition and Health Claims Register (the GB NHC Register). They had therefore removed those claims from their advertising. Tonic Health said the phrase “Rest & Recover” was widely recognised as shorthand for rest and recuperation and was used colloquially to describe moments of winding down, particularly in the evening. They used the claim in that lifestyle and cultural context; in their view, it did not imply physiological change or health benefits. They believed that the Code did not automatically apply in circumstances where a phrase was clearly part of a product range or sub-brand and was not highlighted as an individual claim. Notwithstanding that, they always accompanied general phrases such as “Rest & Recover with a valid authorised health claim from the GB NHC Register. They said they used the claim “Magnesium contributes to the normal functioning of the nervous system” alongside relevant products.","The CAP Code stated that marketers must hold documentary evidence that a testimonial or endorsement used in a marketing communication was genuine, unless it was obviously fictitious, and hold contact details for the person who, or organisation, that gave it. The complainant reported having seen identical wording for a product review appear twice on the same page, attributed to two different customer names. The ASA considered the duplicated reviews created the misleading impression that more customers had independently submitted similar positive feedback than was actually the case. We understood that when the complainant approached Tonic Health in November 2024, they were told that the duplicated reviews had appeared in error due to a technical issue which had now been rectified. However, we understood that duplicated reviews continued to appear as late as January 2025. We welcomed Tonic Health’s assurances that the affected testimonials had been removed, that the issue had been fully rectified and that all reviews would be checked in future. Some of the reviews were duplicated and attributed to the wrong author. We therefore considered they were not genuine. For that reason we concluded the ads were misleading and had breached the Code. On that point, ad (a) breached CAP Code (Edition 12) rules 3.1 (Misleading advertising) and 3.45 (Endorsements and Testimonials). The CAP Code defined health claims as those that stated, suggested or implied a relationship between a food or ingredient, and health, and required that only health claims authorised on the applicable register, which in this case was the GB NHC Register, were permitted in marketing communications for foods. The Code also required that general health claims, which were claims that referred to the general benefits of a nutrient or food for overall good health or health-related well-being, must be accompanied by a specific authorised health claim. We first assessed which claims were specific health claims and which, therefore, must be authorised on the GB NHC Register. Ad (b) stated, “THE BEST SLEEP SUPPLEMENT ON THE MARKET” and “Are you struggling with sleep?”. We considered those were specific health claims because they implied that the supplement, and its listed ingredients – magnesium, ashwagandha and lemon balm – provided the beneficial health effect of aiding the quality of sleep. We further considered that “THE BEST SLEEP SUPPLEMENT ON THE MARKET” was a comparative specific health claim because it implied that the product was the most beneficial to sleep quality. We welcomed Tonic Health’s assurance that they had removed the claims. However, we had not seen any evidence which demonstrated that they were authorised on the GB NHC Register. The ad further stated “[…] each effervescent blends 300mg of essential magnesium, 100mg of KSM-^^ Ashwagandha, and 500mg of calming lemon balm. This powerhouse combination helps ease stress, improve sleep, and support muscle recovery so you can wake up refreshed […]”. We considered that those were specific health claims that the substances named had the beneficial effect of relieving stress, improving sleep quality and supporting muscle recovery. However, we had not seen evidence that those claims were authorised on the GB NHC Register. We then assessed which claims were general health claims, which must be accompanied by an authorised specific health claim on the GB Register. We acknowledged Tonic Health’s comments; however, the Code applied to claims that appeared in product names in the same way that it did to claims appearing elsewhere in ads. We considered the claim “Rest & Recover”, in the context of an ad for a supplement on an account for Tonic Health, would be understood as a reference to the general benefit of the supplement for overall good health and wellbeing. We considered it was therefore a general health claim for the purposes of the Code and would only be acceptable if accompanied by a relevant specific authorised health claim. Because we had not seen any evidence that the specific and comparative health claims in ad (b) were authorised on the GB Register, and because the ad made a general health claim that was not accompanied by a relevant authorised specific health claim, we therefore concluded that it breached the Code. On that point, ad (b) breached CAP Code (Edition 12) rules 15.1, 15.1.1 and 15.2 (Food, food supplements and associated health or nutrition claims) and 15.7 (Food supplements and other vitamins and minerals).","The ads must not appear in the form complained of. We told Tonic Nutrition Ltd t/a Tonic Health to ensure that future testimonials accurately represented customer feedback. We also told them to ensure any specific health claims or comparative specific health claims made in their future advertising were authorised on the GB NHC Register and complied with the conditions of use for those claims. Additionally, any general health claims needed to be accompanied by a relevant authorised specific health claim.",https://www.asa.org.uk/rulings/tonic-nutrition-ltd-a24-1269415-tonic-nutrition-ltd.html
