title,background,ad_description,issue,response,assessment,action,url
ASA Ruling on Bodystreet Franchise (UK) Ltd t/a Bodystreet,"Summary of Council decision: Three issues were investigated, all of which were Upheld.","A website, www.bodystreet.co.uk, for Bodystreet, a fitness studio in Eastcote, featured the text “Bodystreet is an innovative workout studio that combines expert personal training with the buzz of Electro Muscle Stimulation (EMS)”. It explained that “At Bodystreet you wear a special training suit that helps your muscles work harder”. It stated, “We are Europe’s leading provider of EMS training”. Other text stated, “You can reach all your health & fitness goals with Bodystreet Eastcote - the fitness studio where 20 minutes of exercise is enough for the week!”. Under the heading, “Only 20 minutes”, the website stated, “In conventional exercise your muscles work between 40 to 70% of their capacity. During a Bodystreet workout your muscles work to more than 90% of their capacity. And that's with every contraction. With a Bodystreet workout using our high-tech suit you are able to achieve 85 contractions (reps) per second. This makes the training both intensive efficient and effective - hence only 20-minutes per week”. Elsewhere the website read, “This revolutionary fitness system is so effective that one 20 minute workout a week is enough to meet most people's goals and approximately 95% of our members at Bodystreet Eastcote train only once a week to achieve their fitness or weight loss goals […]. With Bodystreet all it takes is 20 minutes a week […]”. The website also stated, “EMS training doesn't just exercise and build up your muscles. It also stimulates the metabolism, which leads to a significant reduction in body fat within a very short time”.",The complainant challenged whether the following claims were misleading and could be substantiated:,"1. & 2. Bodystreet Franchise (UK) Ltd t/a Bodystreet said they understood the volume and level of evidence required to substantiate claims in their advertising. They submitted a meta-analysis, a systematic review, a combined systematic review and meta-analysis and three studies. They also provided an article on electrical muscle stimulation (EMS), a research-institute overview and two pieces of guidance from the NHS. They said their primary target customer base consisted of middle-aged or older adults, people returning to exercise after a long break, individuals with limited time or mobility, and people who found conventional gyms unapproachable or unsuitable. They believed that the cohorts within the studies provided were representative of their target customer base. Bodystreet explained that guidelines for safe use of EMS stipulated it should not exceed 20 minutes for all but the most athletic, due to intensity and recovery time, and to avoid the risk of muscle damage. They said that the statement that one session per week was sufficient was grounded in widely accepted industry guidance which cautioned against using EMS more than once per week. They said that this guidance came from the equipment manufacturer, their franchisor and an industry association. They were concerned that removing the reference to one session per week could encourage unsafe training frequency and expose consumers to health risks from excessive EMS usage. It was their operational experience that significant weight loss had been achieved through adherence to the Bodystreet method with only one session per week. They said that was supported by extensive member feedback across their studios and that 95% of their members trained once a week. They said that EMS training had been associated with various health and fitness benefits, including increased muscle strength, improved body composition, and enhanced physical performance. Bodystreet said that EMS could stimulate all major muscle groups simultaneously with adjustable intensity, making it time effective and, because of its low mechanical impact EMS was suitable for individuals regardless of age, size, mobility and fitness level, including those with joint problems. Bodystreet believed EMS induced short-term changes in muscle metabolism, as well as long-term improvements in muscle function and reductions in intramuscular fat. They said that increasing muscle mass through strength training sped up metabolic rate, made the body more efficient at burning calories and could lead to fat loss, when combined with a balanced diet. 3. Bodystreet believed they were the first company to introduce EMS boutique fitness studios and an EMS studio franchise model in 2007. They said they led the market with equipment innovation and workout methods. That was the basis of their claim to be Europe’s leading provider of EMS training. Notwithstanding that was the basis of the “leading” claim, they also said they had the most number of studios and memberships in Europe, and could also rely on size to make the claim. They provided a 2025 report on the European health and fitness market, produced by a non-profit organisation representing the European fitness sector, in conjunction with a consultancy firm. They said that they had been consistently recognised in this annual report as the leading EMS studio operator in Europe. They believed none of the other operators listed in the 2025 report specialised in EMS-only studios and that this substantiated their claim to be Europe’s leading provider.","The ASA considered that consumers would understand claims such as “one 20 minute workout a week is enough to meet most people's goals and approximately 95% of our members at Bodystreet Eastcote train only once a week to achieve their fitness or weight loss goals” to mean that one 20-minute EMS session at Bodystreet per week would provide an individual with the same physiological results, such as weight loss, cardio and muscle improvements, as a longer weekly session or multiple sessions at a traditional gym, and could therefore be a time-saving alternative. We considered that consumers would interpret it as an efficacy claim rather than a caution against using EMS more frequently. We acknowledged Bodystreet’s comments regarding their target customer base, however the claim referred to “most people” and therefore any evidence supporting that claim needed to be relevant to the general population. We considered that consumers would understand the claim “stimulates the metabolism, which leads to a significant reduction in body fat within a very short time” to mean EMS training would lead to a reduction in body fat in a very short time compared to a traditional gym workout because it stimulated the metabolism. As above, we considered that because the claim was not qualified to apply to particular groups of people, the evidence supporting it needed to relate to the general population. A substantive body of relevant evidence, consisting of clinical trials conducted on humans that had been published and peer-reviewed, was needed to substantiate both claims. We assessed the evidence provided by Bodystreet.The meta-analysis considered the results of five trials which measured the effects of whole-body EMS (W-BEMS) on people who had been classified as being at moderate to high cardiometabolic risk. The trials recorded the effects of W-BEMS on the participants’ metabolic syndrome score which included measurements for blood pressure, triglycerides, abdominal circumference and insulin resistance. We considered that cohort did not represent the general population, and the measurement outcomes were not relevant to the claims that one 20-minute session of EMS would provide equivalent benefits to longer sessions at a conventional gym or that EMS stimulated the metabolism to reduce fat in a very short time. We therefore considered the meta-analysis was not adequate substantiation for the claims in the ad. The systematic review covered 21 peer-reviewed studies that had applied electrical stimulation in lower and upper limbs simultaneously. The review authors observed that the studies exhibited a moderate to high risk of bias and noted a lack of randomised controlled studies on the subject. They commented that the limited amount of scientific evidence found did not allow for definitive conclusions about the effects of WB-EMS. We therefore considered that the systematic review was not adequate substantiation for the claims. The combined systematic review and meta-analysis covered 16 studies with 897 participants. The studies included some controlled trials, and WB-EMS trials with at least one exercise group and one control group. Across the studies, cohorts were of various ages, body mass indexes and physical conditions, although many studies focused on specific cohorts or conditions such as obesity or back pain. The authors acknowledged this restricted the extent to which the outcomes could be generalised. While WB-EMS was the only intervention in most of the studies, two combined WB-EMS with other interventions. This included a study on people with metabolic syndrome where participants had a calorie-restricted diet. The review reported some positive effects of WB-EMS effects on muscle mass and strength but not on total body fat. Furthermore, the results would apply predominately to moderately old to older, untrained or at least non-athletic cohorts, rather than the general population. The training frequency and duration of the interventions varied across the studies, from one to five sessions per week and were not limited to one 20-minute session of WB-EMS per week. Due to those limitations, we considered that the combined systematic review and meta-analysis was not adequate substantiation for the 20 minutes per week or metabolism-stimulation claims in the ad. The first of the three studies looked at the effect of EMS training on intramuscular fat in older adults. The cohort of 19 comprised nine women and 10 men, aged between 61 and 78. They performed EMS training of a specific muscle group on the front thigh three times per week for 12 weeks with each session lasting 30 minutes. Because the study had a small, unrepresentative cohort, exercised only one part of the body, lacked a control group, had more frequent and longer sessions than 20 minutes per week, and the only outcome measure was intramuscular fat, we considered it was not adequate substantiation for the claims. The second study looked at the effect of exercise training on fat loss. As it did not refer to EMS, we considered that it was not adequate to substantiate the claims. The third study looked at metabolic responses and muscle fatigue during whole body WB-EMS, voluntary exercise and their combination. It was partly funded by a manufacturer of fitness products and used a custom-made stimulator, based on a commercially developed device, for 15-minute exercise sessions. The cohort comprised 13 healthy men aged around 20. While the study suggested that the combination of W-BEMS, with low to middle intensity exercise could enhance metabolic response to a level equivalent to high intensity exercise, we considered that this did not equate to the claim that it stimulated the metabolism in such a way as to lead to a significant reduction in body fat in a very short time compared to a traditional gym workout. Furthermore, the study’s cohort was small and not representative of the general population. Also, the study did not include a control group and it was unclear whether the device used was the same as, or equivalent to, Bodystreet’s device. We therefore considered that the study was not adequate substantiation for the claims. We considered that the article, research-institute overview and NHS guidance, which provided generic information, some of which was unrelated to EMS, were not adequate substantiation for the claims. We concluded that the claims that 20 minutes of training at Bodystreet’s studio was enough for a week and therefore would provide an individual with the same physiological results, such as weight loss, cardio and muscle improvements, as a longer weekly session or multiple sessions at a traditional gym had not been substantiated. Neither had the claim that it stimulated the metabolism leading to a significant reduction in body fat in a very short time been substantiated, We therefore concluded the claims were misleading. On those points, the ad breached CAP Code (Edition 12) rules 3.1 (Misleading advertising), 3.7 (Substantiation) and 3.11 (Exaggeration). We understood that Bodystreet had intended the claim “We are Europe’s leading provider of EMS training” to be a first-to-market claim. However, the claim was not qualified and we considered, in that context and in the absence of further explanatory text, consumers were likely to understand it to mean they were the market leader in Europe and therefore had the largest turnover. We acknowledged Bodystreet’s comment that they had the most number of studios and memberships in Europe, and we considered the report provided by them. The report was published in 2025, after the ad was seen. Notwithstanding that, whilst the report stated that Bodystreet had a large number of clubs in Europe (284), it did not state that Bodystreet was the largest provider of EMS training in Europe. Furthermore, the report did not cover all fitness chains in Europe and it stated that the information provided within it had not been verified or audited. We therefore considered that the report was not adequate substantiation for the claim. We concluded that the claim “We are Europe’s leading provider of EMS training” had not been substantiated and was misleading. On that point, the ad breached CAP Code (Edition 12) rules 3.1 (Misleading advertising) and 3.7 (Substantiation).","The ad must not appear again in the form complained of. We told Bodystreet Franchise (UK) Ltd t/a Bodystreet not to claim that 20 minutes of exercise at their studio was enough for a week or that their EMS training stimulates the metabolism sufficient to reduce body fat within a very short time, unless they held adequate substantiation for the claims. We also told them not to claim they were Europe’s leading provider of EMS training, unless they held adequate substantiation for the claim.",https://www.asa.org.uk/rulings/bodystreet-franchise--uk--ltd-a24-1271058-bodystreet-franchise--uk--ltd.html
ASA Ruling on HOMA Games SAS,"Summary of Council decision: Two issues were investigated, both of which were Upheld.","An in-game ad for the mobile game app Tape Thrower, seen in the Belt It mobile app, on 29 March 2025. In low-detail, cartoon style animation, the ad featured a woman wearing only red heels and a facemask, standing on a catwalk with her hands on her hips. Her breasts and midsection were obscured by pixelation, although her belly button and the shape of her breasts were still visible. The tape thrower was directed towards her. Text in the caption below stated, “Tape Thrower” followed by “Throw and hit with duct tape!”.","The complainant, who believed the image was overly sexualised and objectified women, challenged whether the ad:","Homa Games SAS t/a Homa Games said that the ad was for Tape Thrower, which had a PEGI 3 rating on Google Play and a 4+ rating on the Apple App Store. The game was designed in a light-hearted, comedic style inspired by the ""prank"" genre and was not intended to offend or reinforce gender stereotypes. The ad was placed through third-party advertising platforms, which managed its distribution, including its appearance within the Belt It app. They acknowledged the concerns and paused the campaign in the UK. They said that they were reviewing internal processes to ensure better ad compliance.","The ad, which was for the 'Tape Thrower' game and depicted various scenarios, including one where the players could throw duct tape to hit and cover a woman’s body, featured a nude woman whose face was obscured by a facemask, with pixelation obscuring her midsection and breasts. We considered she was therefore depicted in a manner that was sexually suggestive and made her body the central focus of the ad. The ad also presented her as a passive target in the game. We considered that the ad objectified and stereotyped the woman by presenting her as a passive, sexual object with the sole purpose of titillating viewers. We concluded that the ad was likely to cause serious offence and included a gender stereotype in a way that was likely to cause harm. We understood the game was seen in the Belt It mobile app, a puzzle game which had an age rating of 4+ years and therefore could be downloaded by children. We considered that those playing an unrelated game would not expect to be served an ad which featured a naked woman, and considered the ad had been irresponsibly targeted. Notwithstanding that, because we considered that this specific ad was likely to cause serious offence and included a gender stereotype in a way that was likely to cause harm, it was not suitable to be featured in any game. We therefore concluded that the ad was irresponsible and breached the Code.The ad breached CAP Code (Edition 12) rules 1.3 (Social responsibility), 4.1 and 4.9 (Harm and offence).","The ad must not appear again in its current form. We told Homa Games SAS to ensure that their ads were socially responsible and did not cause serious or widespread offence, including by featuring a harmful gender stereotype by objectifying and sexualising women. We also told them to ensure that their ads were responsibly targeted.",https://www.asa.org.uk/rulings/homa-games-sas-a25-1285213-homa-games-sas.html
ASA Ruling on Honeytech Ltd t/a Honeytoon,"Summary of Council decision: Two issues were investigated, both of which were Upheld.","Two paid-for X (formally Twitter) ads for HoneyToons, a webcomic platform: a. The first ad, seen on 22 March 2025, featured the caption “[joker emoji] A harmless joke…or a path to unexpected consequences? When a simple prank spirals out of control, tension rises, and desires awaken. [Smirking emoji] What happens when boundaries are pushed too far? Find out in Prank Goes Wrong — where mischief turns into something much more intense… [fire emoji] [ devil emoji]”. An anime/manga-style image underneath, presented in a comic book layout, depicted a young woman and a man wrestling. She had him in a headlock, with her legs wrapped around his waist. A speech bubble read “BRO, I’M DONE WITH YOUR PRANKS!”. The following panel showed the same woman with an angry expression, accompanied by text that read “OMG!”, and “YO, IS THAT A THIRD LEG?”. A final image, in which she looked surprised, featured the text “OMG! BUT I’M YOUR SISTER!”. Underneath the image, text stated, “Hot comics, follow now! [fire emoji]”, with a hyperlink to honeytoon.com. b. The second ad, seen on 29 March 2025, featured the caption “[fire emoji] A honeymoon like no other…a desire too forbidden to resist. When boundaries shatter and temptation takes over, will he give in or walk away? [wink emoji] Honeymoon with My Mother-in-Law- a story where passion blurs the lines of family and seduction. Tap in if you can handle it…[wine emoji] [fire emoji]”. An image underneath, presented in the same style and comic book layout as ad (a), featured a man approaching a sleeping woman. A speech bubble read ""IS SHE ASLEEP?"" followed by another stating ""I’M SORRY BUT I CAN’T RESTRAIN MYSELF ANY LONGER!"". The scene portrayed in the next image was of the man smiling and standing behind the woman while she appeared shocked. The final panel showed the woman turning around with the text ""OMG!"" and ""BUT I’M YOUR MOTHER-IN-LAW!"". Beneath the image, the text read ""Hot comics, follow now! [fire emoji]”, with a hyperlink to honeytoon.com.",,1. & 2. Honeytech Ltd t/a HoneyToon did not respond to the ASA's enquiries,"The ASA was concerned by Honeytech Ltd t/a HoneyToon’s lack of response and apparent disregard for the Code, which was a breach of CAP Code (Edition 12) rule 1.7 (Unreasonable delay). We reminded them of their responsibility to respond promptly to our enquiries and told them to do so in future. The text in the caption, speech bubbles, and imagery in ad (a) portrayed a man becoming sexually aroused as a woman wrestled with him. The scene depicted the woman being placed in a sexual situation without consent, before revealing that they were brother and sister. In ad (b), the text in the caption, speech bubbles, and imagery depicted a man sexually assaulting his mother-in-law. Both ads featured sexually explicit content, which we considered was likely to cause serious and widespread offence in the context of an untargeted paid ad on X. Furthermore, the sexual situations depicted were non-consensual, with ad (b) unambiguously depicting sexual violence against a woman. Additionally, the portrayal of the women as a sister and mother-in-law to the men played on pornographic tropes relating to the taboos of incest and sexual relationships with other family members. We considered those aspects of the ads’ content were also likely to cause serious and widespread offence. We additionally considered both ads objectified and stereotyped women by presenting them as objects of sexual gratification and therefore included a gender stereotype that was likely to cause harm. For those reasons we considered the ads were not suitable to be featured in any medium. While we acknowledged the ads were for a webcomic platform featuring adult themes and sexually suggestive and explicit content, we considered the advertiser must ensure that their ads did not feature content which was likely to cause offence or harm. Overall, we concluded that ads (a) and (b) breached the Code, because: they were likely to cause both serious and widespread offence; included gender stereotypes in a manner likely to cause harm: and had been irresponsibly targeted. On points 1 and 2, ads (a) and (b) breached CAP Code (Edition 12) rules 1.3 (Social responsibility), and 4.1 and 4.9 (Harm and offence).","The ads must not appear again in the form complained of. We told Honeytech t/a HoneyToon to ensure future ads were prepared responsibly, did not contain harmful gender stereotypes, and did not cause serious or widespread offence, including through references to incest, scenes that depicted women as objects of sexual gratification or that trivialised or condoned sexual assault or sexual violence. We referred the matter to CAP’s Compliance team.",https://www.asa.org.uk/rulings/honeytech-ltd-g25-1287790-honeytech-ltd.html
