,Comments,label
125,"""

Reply from ColonelHenry
I have been pissed this week, I admit. Why?
 First, last week, I get harassed by one hypocritical """"rule nazi"""" editor taking things too far (SummerPhD) so when I pointed out her similar shortcomings and intransigence and said frankly """"this user is an asshole"""" and explain why and state """"this is the kind of user that drives editors away from wikipedia"""" I get blocked for 24-hours.  I say """"asshole"""" once, I get blocked.  She calls me a """"dick"""" over a dozen times, and gets warned.  Go figure. I hate nitpicking rule nazis because they end up proving themselves to be hypocrites, and unfortunately without fool other meek fools who tend to be admins tend to side with the rule nazi.
 In the midst of that Daniel Case continued to plow ahead insisting on a rushed revision of ALONJ that no one else raised as a concern (so, not immediately dire) after being asked first politely and respectfully several times to """"wait until after TFA"""" and he still ignored it.  If someone politely asked me to wait a few days before doing a drastic edit on an article they worked on that was getting a little attention, I would...because I find it akin to telling a concert pianist to change their entire concert programme an hour before the recital. Only when I responded in anger did he pull back on the reins and realize """"hey, maybe I should wait till after TFA.""""  A little deference on his part would have gone a long way.  I'm not averse to his edits, but seriously, after TFA would have been more than fine.  I considered it insulting, and his refusal to listen to a polite request stated by both myself and the other major contributor to the article was considerably disrespectful.
 And then when the article I've worked on becomes TFA we get inundated with constant vandalism and petty edits that were not necessary (i.e. people like you, Kevjonesin, insisting on 19th instead of nineteenth).  Is that really a necessary place to make a stand and pick a fight? Seriously, don't you have better things to do with your time?  I'd rather argue over an analysis of Hegel's influence on Nietzsche's """"Will to Power"""" or Hindu mysticism in Eliot's Four Quartets than bicker about things as meaningless as whether honour should be spelled -or or -our.

As for why, I like """"nineteenth"""" as opposed to 19th, several style guides (including Chicago/Turabian) advocates it, and growing up I was taught that all numbers under 20 should be spelled out. Whether cutting two dozen letters from an article going to 19th and 20th is going to make a difference for """"brevity's sake"""" on a 40-page article, is a lame claim and frankly a waste of time for both of us. I like the aesthetic of it spelled out, it's allowed, and the option of spelling it out is a bonus in an article to avoid confusion with too many other numbers.  When considering such an unnecessary subjective edit, deference should be made to style set by the editors who spent months on an article...and when nothing is wrong to it, deference is entirely warranted.  That isn't ownership, it's just courtesy and good judgment. After all, if I stood in your yard while you were painting your house gray and proceeded to insist you to paint your house orange, you'd tell me to """"kick rocks.""""

As far as I'm concerned, this is over. Move on. I am not addressing this any further, because nonsense like this keeps me from contributing and convinces me to leave Wikipedia again, and this time for good. If Hell is other people, Wikipedia constantly proves itself to be the eighth and ninth circle.   """,1
2247,"poster 

I have sent the e-mail. -Garrett",0
2638,"Megyn Kelly's Latest Look on 'Today' Sparks Plastic Surgery Rumors!


Has Megyn Kelly gotten plastic surgery?

The TV star sparked rumors she's gone under the knife after her first-ever Today appearance on Thursday, June 1.



Rumors have previously circulated that the TV star may have gotten Botox, a nose job, and maybe even breast implants. However, Megyn, 46, has never addressed the talk that she's gotten procedures done throughout her career.


However, surgeons have exclusively weighed in on the topic to Closer Weekly! Dr. Andrew Miller suggests, ""I don't see anything other than possibly a little Botox for the forehead and crow’s feet.

Dr. Mardirossian adds that she may have gotten Botox to the forehead, a rhinoplasty, and filler to her cheeks, lips, nasolabial folds, and possibly to her jawline.

Megyn isn't only making headlines for her changing face! During her NBC debut, she seemingly snubbed Today co-host Hoda Kotb — and who knows if she even realized she did it!



After Matt Lauer congratulated Megyn on joining the team (he was sitting next to Hoda and Savannah Guthrie), Megyn said back, ""Hey guys, it's great to be with you, Matt and Savannah."" What about Hoda?! So awkward!

",2
1003,"Don't just strike incorrect information as you did in Flash fiction. Delete it, you moron.",1
922,"A picture of Rob,
 an academic fraud and wiki bully boy",1
2341,"Again, please stop editing Goguryeo article without approvals, also you're helping Chinese/Japanese trolls? Why?Korsentry",0
914,"Hey, Nazi dude: 

Sherpa derpa derp",1
2465,"PLOT TWIST IN 'FATHER-SON' MOVIEMAKER MYSTERY

Forget ""Pearl Harbor"" – Hollywood is buzzing about a true-life scandal involving the paternity of the $140 million blockbuster's director, Michael Bay.

Finally addressing rumors that have circulated for years, legendary director John Frankenheimer admitted he had a one-night stand with the adopted Bay's birth mother, who claimed he was Bay's dad – and that he paid her off.

But Frankenheimer denied ""absolutely, categorically"" that he is the younger director's father.

""We had tests done, and I am not his father,"" Frankenheimer told the Los Angeles Times in an interview published yesterday.

Bay, 37, who's in Honolulu for the premiere of ""Pearl Harbor,"" declined to respond to the bombshell revelation.

""It's a private matter,"" Bay said of the story – which Frankenheimer, 71, unleashed just five days before the release of ""Pearl Harbor,"" one of the summer's most highly anticipated movies.

The older director said his ""one-night stand"" with Bay's birth mom – who was not identified – happened at the Hollywood Roosevelt Hotel while he was making ""Seven Days in May"" in 1963.

Months later, Frankenheimer got a call from his lawyer, the late Frank Wells, who said the woman was pregnant – and had named Frankenheimer as the father.

""I asked Wells, 'What can we do?'"" said Frankenheimer, who feared a scandal would hurt his career. ""We can pay her off,"" the director quoted Wells as advising him. So Frankenheimer paid the mother $7,500, and says he ""didn't hear anything more about this"" until 16 years ago.

By the mid-1980s, Bay, adopted and raised by Jimmy and Harriet Bay in L.A.'s Westwood section, was an aspiring filmmaker trying to find his birth parents.

""I [did] a little investigation,"" Bay told the Times. ""I found [my mom] in three days.""

Then Frankenheimer got a call from the woman's lawyer.

""He said there is a young man at Wesleyan University, and he wants to find out who his real parents are,"" Frankenheimer recalled.
",2
188,"Don't worry, tha fag Klptyzm will be blocked sooner or later.",1
2773,"'Second Act' Cast Stars Milo Ventimiglia & Jennifer Lopez & No One Can Control Their Emotions

Get ready for one of the hottest movie couples ever... and it's a pretty unexpected one, too! TV heartthrob Milo Ventimiglia just signed on to Jennifer Lopez's upcoming romantic comedy, Second Act, and it sounds like we're going to see some sparks fly between them. Milo Ventimiglia will play J. Lo's boyfriend in the new movie, according to Variety, and the casting news has fans of the two stars shook.

Milo Ventimiglia will be playing the longtime boyfriend of Jennifer Lopez's character in Second Act, which is slated to come out next year. We don't know much about Ventimiglia's character yet, but the movie will be about Lopez's character reinventing her life, starting out as a Costco employee who uses her street smarts to make it big on Madison Avenue. Leah Remini will play the best friend of Lopez's character, and Vanessa Hudgens is also attached to play an executive at a consumer goods company. Other cast members include Freddie Stroma (UnREAL, Harry Potter), Dan Bucatinsky (Scandal), and Annaleigh Ashford (Masters of Sex).

This will be the first time Milo Ventimiglia and Jennifer Lopez have ever worked together on a project, which makes it all the more exciting for fans to see these super buzzy stars team up and play boyfriend and girlfriend on-screen. Just call them J-Milo. Or Mi-Lo. Maybe just Milo & J. Lo? I know there's a good couple name in there somewhere!

Although they've never worked together, Milo Ventimiglia and Jennifer Lopez actually have gotten to know one another better over the past year after both stars began helming their respective NBC series — Ventimiglia stars as the deceased father Jack Pearson on This Is Us and Lopez stars as police officer Harlee Santos on Shades of Blue. The two were photographed together at an NBC event back in March, and Lopez has even come out as a massive fan of Ventimiglia's show This Is Us. A couple months ago, she and her boyfriend Alex Rodriguez recreated a scene from the show in which Milo's character Jack did push-ups with his son Randall. Earlier this month, Milo's co-star Chrissy Metz said she was so surprised when she learned Jennifer Lopez was a major fan of the series.

It's safe to say J. Lo isn't the only massive Milo Ventimiglia fan out there. Twitter erupted in excitement after new of the casting broke on Wednesday afternoon. Check out some of the best responses below:

Although, I guess if you're a hardcore This Is Us fan, it may be hard to see Jack Pearson making out with J. Lo and not Rebecca (Mandy Moore). Second Act will be Milo Ventimiglia's first major motion picture in the romantic comedy genre since reemerging to TV fame in This Is Us. He first came to fame as another romantic lead: the small-town bad boy Jess Mariano in Gilmore Girls. His other major TV role between those two was as the paramedic-turned-superhero Peter Petrelli in the NBC drama Heroes.

Jennifer Lopez is best known for being the international pop star behind some of the biggest Top 40 songs of the 2000s, but she's also cultivated a respected career as an actress thanks to movies like Selena, Out Of Sight, and Maid in Manhattan. She currently stars in the crime drama Shades of Blue, and will star in NBC's next live musical: Bye Bye Birdie Live!

The news of Milo Ventimiglia and Jennifer Lopez playing boyfriend and girlfriend is exciting, but unfortunately fans are going to have to wait a while before they can see the on-screen couple together. Second Act is set to come out sometime in 2018, and since it sounds like they're just beginning the filming process now, it probably won't be until towards the end of the year.
",0
2205,"No, Wikipedia:Consensus says, “Consensus is typically reached as a natural product of the editing process; generally someone makes a change or addition to a page, and then everyone who reads the page has an opportunity to either leave the page as it is or change it.” Therefore, there was nothing wrong with me editing.  Chuck Marean",0
743,"""

Yourcousin used a personal attack when he added back his diatribe to my page. He said """"(repasting page deleted by cunt)"""" - I may block him for evading a block )  """,1
983,"""

Abd is Muslim scum, the religion of terrorism  —Preceding unsigned comment added by 79.67.212.36   """,1
1849,"""
On another note, we are going to have TD 5-E at 8 p.m. and Carlos' peak intensity is 90 knots and 972 mbar (from the best track) hami """,0
1063,"TBone? 

Dear sir,
  You are a bitch. I will take a shit on your car. I hope you realize that I own the rights to the entire DC universe and plan to poop on them as soon as I eat out your Granny. Dicks are for chicks, and your not one. Go get T-Boned by some burly man named Dirk. I think jodie foster is a sex beast and she rapes the souls from men ages 18-24. I also would like to bring to your attention that you sir are a wiitard. you make Clark fights his homosexual urges and wants to do Sylvester Stallone. I Want to ride the Italian stallion is what he says",1
423,"Here You Go...

Nope! Never accused you of calling me names. Just another one of your delusions. So, just to shut you up, here are the dates and proof of the Hayes Seminar infiltration that you don't believe happened. Just like the White House, this is the only documentation I am going to provide in a futile attempt to satisfy you. All the rest of your arguments and allegations are just as full of crap as you are. I can disprove them all. But, I'm tired of answering the same stupid questions over and over and wasting time with turkeys like you who REFUSE TO BELIEVE THE TRUTH even when it bites them on the bum, LOL 
Now, go check with your buddy Hayes, you claim to be able to do that, to confirm this and then come back here and apologize like the whipped dog you are. Don't wonder off the topic! You said this didn't happen and that I couldn't confirm it. Here is the proof that YOU are a liar.

Ashida Kim",1
787,@Tomica I say; fucking bring it on; you've over stepped the 3RR which you was recently blocked from so if I get blocked; I sure as hell will take yo' ass down as well,1
1663,"Good, in my original article I said that he was a Dublin university student, meaning a university student in or from Dublin. I had no idea which school. I noticed that someone else wikified it to be Dublin University and your citation has helps settle it. Thanks for the good edit Flowerpotman.",0
2017,"""

I think you're splitting too many hairs here.  It's very apparent that she and Summer are gonna have some business, and it's become obvious that she's graduated from from mere manager to a fighting diva.  People like Paul Heyman or Zeb Colter or Hogan/Lita/Gunn (Tough Enough) are there in non-physical roles, and are listed as such.  Lana has clearly made the jump from that status. Personally, I think the """"Other on-air personnel"""" list should be strictly for those in non-physical roles.  Once Lana started throwing down with Summer, and it became clear that they're destined for a match, then Lana showed that she's above being merely """"other personnel"""".  User:Vjmlhds [[user talk:Vjmlhds|(talk)""",0
1954,"Most popular shows 

Thanks for giving the important and warning message. Squidbillies and Aqua Teen Hunger Force are both Adult Swim's most popular shows are both created by Dave Willis.",0
150,"You can block and block and suck my cock but nothing can stop freedom of speech. In the end, America wins. We always do. Ask Saddam. My sockpuppet army is on the march.  02:13, 30 Mar 2005 (UTC)",1
2863,"Gwen Stefani Shockingly Ruptures Eardrum & Is Forced To Cancel Show — Is She Okay?

Poor Gwen Stefani! The singer shockingly ruptured her eardrum and was forced to cancel an April 27 concert in Las Vegas because of her medical emergency. This is so scary. Is Gwen’s hearing going to be okay?


Gwen Stefani, 47, went through a terrifying ordeal on April 25 when her eardrum ruptured while on a flight. The painful injury landed Gwen in Cedars-Sinai hospital in Los Angeles, where doctors told her not to fly anywhere or sing until it gets healed. The brutal injury came at exactly the wrong time for Gwen. She was supposed to sing at the Power f Love gala in Las Vegas just two days later.

The pop star/The Voice judge had to bow out of the prestigious event at the MGM Grand where she was set to perform a 30-minute live set, because of her limitations. That’s so awful! Guests at the event, according to the Las Vegas Review-Journal, were told about the cancellation right before the event. Gwen recorded a short apology video that was played for the guests and gala honorees: “I am so sorry that I cannot attend tonight, But I wanted to send a message of congratulations to Andre Agassi and my dear friend Ronald Pearlman,” Gwen said.


Blake Shelton & Gwen Stefani Hunt For Eggs With Her Kids During Easter Celebration -- See Adorable Pics
 
The event hosted by the Keep Memory Alive charity to help find cures for memory and movement disorders, honored the tennis legend with the Community Leadership Award, and honored Ronald for his “outstanding philanthropy.” While attendees were bummed that they couldn’t see Gwen’s set, they got an incredible replacement: Jennifer Hudson! There’s No Doubt that Jennifer tore the house down!

Gwen Stefani’s ‘Misery’ Music Video — See Pics

Luckily, Gwen’s doing okay. She was still on The Voice this week and looked happy! A ruptured eardrum is no small deal, though. It occurs when a small perforation pops in the eardrum, sometimes from trauma, ear infection, loud noises, surgery, or flying in a plane with a severe cold. You know how your ears pop in a plane? It’s like that, but way worse. It can lead to temporary hearing loss, or ringing in the ears.

It’s unclear how severe Gwen’s eardrum is injured, but the healing process can take anywhere from a few weeks to a few months, and in some very rare cases, years.

HollywoodLifers, we hope Gwen feels better! Send her your positive get-well vibes in the comments!
",0
2052,"Cliodhna Doyle
Please don't create articles about yourself or your friends.  (Talk)",0
538,"Shutup 

[[Who U think U is you gay nobody thats why you got that userbox your orientation doesn't affect you cuz you tried to sleep with Chris brown, he don't want u go get yo own man you ugly digusting cockroach go touch yoself or something with yo boifriend Yamla, wen is the babya doe septmeber 20072. LOLLLLLLLLLLLLLLLLLLLLLLLLLLLLLLLLLLLLLLLLLLLLLLLLLLLLLLLLLLLLLLLLLLLLLLLLLLLLLLLLLLLLLLLLLLLLLLLLLLLLLLLLLLLLLLLLLLLLLLLLLLLLLLLLLLLLLLLLLLLLLLLLLLLLLLLLLLLLLLLLLLLLLLLLLLLLLLLLLLLLLLLLLLLLLLLLLLLLLLLLLLLLLLLLLLLLLLLLLLLLLLLLLLLLLLLLLLLLLLLLLLLLLLLLLLLLLLLLLLLLLLLLLLLLOOOOOOOOOOOOOOOOOOOOOOOOOOOOOOOOOOOOOOOOOOOOOOOOOOOOOOOOOOOOOOOOOOOOOOOOOOOOOOOOOOOOOOOOOOOOOOOOOOOOOOOOOOOOOOOOOOOOOOOOOOOOOOOOOOOOOOOOOOOOOOOOOOOOOUUUUUUUUUUUUUUUUUUUUUUUUUUUUUUUUUUUUUUUUUUUUUUUUUUUUUUUUUUUUUUUUUUUUUUUUUUUUUUUUUUUUUUUUUUUUUUUUUUUUUUUUUUUUUUUUUUUUUUUUUUUUUUUUUUUUUUUUUUUUDDDDDDDDDDDDDDDDDDDDDDDDDDDDDDDDDDDDDDDDDDDDDDDDDDDDDDDDDDDDDDDDDDDDDDDDDDDDDDDDDDDDDDDDDDDDDDDDDDDDDDDDDDDDDDDDDDDDDDDDDDDDDDDDDDDDDDDDDDDDDDDDDDDDDDDDDDDDDDDD.                                                          [[User:",1
279,"""
Neo Spirit Pro Wrestling buddy. I'm training under the name """"Kaine"""" which I ripped off of my buddy ImmortalKaine. Also, I'm pretty sure you can say Fuck on wikipedia as I've already fuckin said it 10 fuckin times you fucking moron. I've already filed an ANI report against you as you have created several accounts just for the purpose of starting flame wars. So you're too damn late. Also your aunt isn't Donna Goldsmith, retard.  """,1
719,"""
 In other words: """"suggesting questions that might be addressed on a talk page is forbidden and is considered scandalous because us bullies say so, so fuck off newby!  We'll delete any suggestion that there might be any questions about Eliot/GreenC and will beat you into submission!"""" Got it!  You two both from the same pair or both in the same (unnameable organization)? (or you gonna """"redact""""/censor this too for asking questions that should not be asked?)""",1
2037,"Best Man 

I read in an interview in this months issue of FHM that he wasn't actually Alexander Armstrong's best man. Funnily enough that part of the interview was about innacuracies on wikipedia. He tried to put it right but couldn't because of the auto rule.",0
804,"""

Again, I never asserted the Greaseman's death.

Since Neturalhomer chooses to edit his User Talk page to erase the past, I will post the relevant exchange here (he gave """"removing vandalism"""" as the reason for editing it out; his only tool is a hammer, perhaps, so he sees me as a nail, perhaps)

Your Lie(s) About Me

You wrote: """"Final Warning

Saying things like """"DC101 IS HIS FUCKING EMPLOYER!!!"""" and """"Don't be a douche"""" is a good way to get blocked....fast. Tone the language down...and pay attention. Greaseman ain't dead. If you continue, to add continued, now, lies to Wikipedia, I will report you to AIV and to your ISP, Verizon. Stop now, this is your final warning. - NeutralHomer • Talk """"

Yes, I did use the language (on a talk page) and if it will make the booboo feel better, I apologize. But who doesn't enjoy a nice summer's eve?

BUT, you need to STOP LYING about me. I never said the Greaseman was dead, only that his death had been reported by sources considered reliable by Wikipedia standards. A little attention to detail on your part would be much appreciated, Eve. Otherwise, perhaps it is I who shall report you. Tell you what: you admit and retract your lie and I will consider the matter closed. Fair?

Let's look at your odd writing style: """"If you continue, to add continued, now, lies to Wikipedia,"""" Just what are you going for there?

I've never put a lie on Wikipedia, contrary to your assertion. Anyone who lies about me can go screw.

Your threat to report me to my ISP (FOR WHAT, EVE?) is beyond pathetic. Two pops for yes!! Report away.

Now, the admin who blocked me said that more than one reliable source was needed on sensitive matters.  He did not research sufficiently to reach a correct conclusion.

Let's all remember, shall we, that I never said that Greaseman was dead, simply that he was REPORTED DEAD.  There's a big difference, and the fact that it was reported is not in dispute.  I NEVER SAID GREASEMAN WAS DEAD.  Yet Neutralhomer continues to assert that I did.  THAT IS A LIE.  I consider someone lying about me a personal attack, under Wikipedia guidelines.  Is this a """"separate but equal"""" or """"separate and unequal"""" system?

The admin who blocked me wants more than one source that someone said something on the radio.  Let's look at Wikipedia's entry on Cesar Romero's personal life, shall we?  There is NO source cited for his death, nor his homosexuality, yet those are all sensitive topics, are they not?  Why doesn't Neutralhomer report the author of this page for vandalism?

The fact that Neutralhomer claims that dealing with me gave him a migraine on the talk page of the admin who blocked me demonstrates that this is a personally based effort on his part.

To recap: I never lied.  I never vandalized.  That should be enough.

Now let's look at Wikipedia's reckless report of Cesar Romero's death and homosexuality, shall we?  Sensitive matters, no?

Personal life

Romero believed in liberation theology. Romero was very Christian yet still believed in a utopian society whose belief is that Christ's kingdom would be very similar to Marx's envisionment of communism, and held to this belief until his death.[1][2]

Romero always claimed his grandfather on his mother's side was Cuban poet and patriot José Martí, although his mother's parents were legally Carmen and Manuel Mantilla with José Martí as his godfather. There was some speculation that Maria was fathered by Martí who was a boarder in the Mantilla household, but he never claimed Maria as his daughter in his lifetime.

Romero was never married, despite proposing to at least one woman. Romero made regular appearances on the Hollywood social circuit, usually in the company of an attractive actress, and he was almost always described in interviews and articles as a """"confirmed bachelor."""" Romero discussed his homosexuality in a series of interviews with author Boze Hadleigh, with the understanding that they would not be published during his lifetime.

Romero wore a man's tennis bracelet inscribed with his favorite nickname: """"Butch."""" The term was reportedly bestowed on Romero by his one-time dancing partner Joan Crawford, who teased Romero by telling him: """"You're so butch!"""" While Romero's homosexuality was an """"open secret"""" in Hollywood, the movie-going public was unaware of his sexual proclivities and there was never any embarrassing scandal surrounding his male liaisons, which shows the care and finesse with which he conducted his private life for more than 60 years.

Romero was a mainstay of the Hollywood social circuit until his death in 1994. He was interred at Inglewood",1
1789,"""
 Reverted 
Sorry, I reverted it back to original. Thank you for warning me! Diablo """,0
979,"""

I can just imagine John Curtin's response at being """"celebrated"""" by these neo-Nazi cultist filth.  """,1
