,Comments,label
342,Dejaun Butler is gay and loves men.,1
130,SUZANNE IS A LOSER!!!,1
686,"""

Shouldn't we balance this section out with some people who don't care or think the Monkees were an abomination?Like this: Fred Cocklskew of Frampington said """"Who gives a s***?"""". like that I think that would be good, yeahhh?""",1
1922,"""

 Agnotism 

I read in book """"Lance Armstrong's book: It's Not About the Bike: My Journey Back to Life"""" that he is Atheist,please give references for Agnotism of Armstrong  """,0
2757,"
James Corden just asked Kim Kardashian about the Khloe and Kylie pregnancy rumours
2017-11-16 08:52:00
Two months after rumours broke out that both Kylie Jenner and sister Khloé Kardashian might be pregnant at the same time, we still don't know any more than we did in September. Big sis Kim Kardashian won't be ending the suspense any time soon, judging by her recent appearance on James Corden.

Kim took part in a particularly nasty game of ""Spill Your Guts or Fill Your Guts,"" a staple of the Corden show where James and a guest ask each other questions that could get them in trouble. If one of the players refuses to answer, they have to eat a gut-churning ~delicacy~.

When asked to rank her mum and sisters from best to worst dressed, Kim didn't hesitate to oblige — understandable, since the alternative was to drink bird saliva (eek!). But when the million-dollar question — the question of Kylie and Khloé's pregnancy rumours, obvs — inevitably came up, Kim chose to drink a sardine smoothie instead. This is one of those moments we're glad we're not famous.

Kiki has shut down rumours about her reaction to Kylie's pregnancy, but hasn't given us any clues as to whether the rumours are actually true or not. Guess we'll just have to keep being patient.

As for James, he refused to reveal which of his guests was the most obnoxious (he ate a scorpion instead!), but did say that Kylie was his least favourite Kardashian. The youngest sister was supposed to appear on Corden's show, but apparently backed out.
",0
2336,Ludwig Gaston von Sachsen tranlsation,0
1021,Yes they were Hitler Stated that Slavs were lesser races and should be salves or killed,1
2158,"And this is off the track, but if you continue to make false accusations against me, I reserve the right to speak to someone about it.  What's up, Doc?",0
2110,", 6 January 2008 (UTC)

That is indeed, fairly precisely, the position of some monarchists, as well as reasoning of some jurists and scholars, to this matter. Which then means that it would be POV to erase Carlos Patrick from the article, as there are at least as good reasons for his legitimacy as heir as to those of the other Hohenzollern line.   14:56",0
771,"User:Nat is just a piece of shit, ignore him.",1
2104,"Rao Jazib Saeed 

Rao Jazib Saeed is a business graduate from NUML Islamabad native of Multan Pakistan.",0
1965,i just got on here a little while ago i am looking for the Tennis player Giovanni Lapentti no luck yet but i will keep looking,0
1090,"Survey says, chanting fox is idiotic, you people are to be held at a higher level and should just block some one and not make smart ass nazi comments. You people just delete what you dont like, mostly things that make you look stupid, and you people wouldn't stand a chance on an un-edited format. George W. Bush is one of the greatist presidents ever!",1
369,"""
 You wrote -'I myself am Christian, but I will not allow myself the shortcut of rationalising that rape 'turned' an otherwise straight Lonnie Frisbee into a """"Gay Sinner"""".'
Well...I myself am Christian, but I will not allow myself lying gay acitivists to PRETEND that rape does not'turned' an otherwise straight Lonnie Frisbee into a """"Gay Sinner"""". I think the only reason why you lying gay activists won't acknowledge this phenomena is, at it's very best, it cuts into your argument that people are born gay, and at worst, is seens as a threat to your recruitment activities! lol 65.48.16.58  """,1
250,"""

I've sanitised Bushell's language and deleted the earlier quote which was FAR more offensive (Bushell claimed he wouldn't like to """"fuck her"""".) How can it be concluded this language is acceptable but calling Trott a """"dumpling"""" isn't? This smacks of hypocrisy and an obvious anti-bias to """"new"""" editors on EastEnders pages.   """,1
724,"""

SANDAHL YOU HAVE LABELLED ME AS """"A VANDAL"""" WITHOUT ANY WARNING - THIS IS IN DIRECT CONTRADICTION TO STATED WIKIPEDIA POLICY AND I AM CONSIDERING TAKING LEGAL ACTION AGAINST WIKIPEDIA AND YOU PERSONALLY, AS WELL AS CIVIL LIBEL CLAIMS.

IT IS APPALLING THAT WIKIPEDIA'S """"UNIVERSITY SYSTEM"""" OF EDITING IS BECOMING ANTI-INTELLECTUAL AND FASCIST, AND IN THAT WAY,
IT IS PERHAPS EVOLVING INTO THE MODERN UNFORTUNATE STATE OF THE """"UNIVERSITY"""" ESTABLISHMENT. 

THERE IS NOTHING VANDALLIC ABOUT MY POSTS AND YOU ARE OUT OF LINE FOR LABELLING ME A VANDAL.

CONSIDER THIS A FRIENDLY WARNING.

Sincerely,
The Legendary Danny O'Doul""",1
1558,"Ownership 

Who owns Taransay?",0
1156,"You r  a Jerk 

You Son of a Bitch.. Uss page ko redirect Karke tujhe kya mila. YOu Pervert.. I know Its you who protected that page from editing. Saale khud ka kuch nahi jaata fir b dusor ko Problem Create karne ke Liye hamesha Taiyaar rehte ho behenchod kaheen ke.. ho gaya khush page ko Protect karke. Abb ApNi  maa & sis ko B protect kar. nahi toh aake chod dunga Un dono ko. BAstard & Rascal. Maa Chuda Bhosdke... Sincerely request kiya toh b aise kar raha hai jaise ki ne teri maa & behn Ka Gangbang kar diya ho.. Son of a bitch",1
1772,"Thanks 

Thank you for your answer to my question. I do think that your contributions are impressive, and show that you have spent a great deal of effort improving the encyclopedia. I should have mentioned that in my question. I'm not interested in article writing per se, as some other people may be. — Carl ( · talk)",0
2569,"Janet Jackson's Secret Plastic Surgery

Janet Jackson is tired of hiding her withered old lady hands under long sleeves and gloves — so now she’s giving them a makeover!

Janet, 51, will undergo “hand rejuvenation surgery” to give her old claws a youthful look, sources squealed to The National ENQUIRER.

“She’s tried expensive hand creams and massages, but her hands still look wrinkly, like an old woman’s,” said an insider.

“She’s ashamed of them, and hides them beneath long sleeves and gloves. Her confidence could sure use the boost!”

Janet gave birth to her first child, son Eissa Al Mana, Jan. 3.

The “Control” superstar then split from her hubby Wissam amid claims he verbally abused and imprisoned her.
",2
1323,"You have never met or been photographed with Keith Wigdor. 

Whoever you are, I am asking you to not interfere with the article about Keith Wigdor.  You have no resources or connections to him (unless you are somehow being deceptive), so really you are not any sort of expert on this artist.   20:04, 17 Dec 2004 (UTC)",0
410,"DAHN IS ILLITERATE AND HAS A SMALL PENIS
Yes, you know the typical wikipedia user.  He is a loser.  He has no life.  He is sexually frustrated.  His inability to satisfy his will to power is taken out over the net.  

DAHN - if you want to revert my changes, read them first.  I will fight you!",1
1195,"""
 You reverted my at other pages where Dan pinged you; it will not be difficult to show that you meatpippett for him at numerous pages. Stop being a bully.  (talk|contribs)  """,1
1009,"fuck you jeremy!  

Hey Jermey A,
I just thought I'd mention that you should pursue getting a real job, you piece of dog shit.
Furthermore, fuck you. In addition to that, I think you MAY be homosexual (citation not needed), because the grapevine has shed light on your impotence issues around women. That, or you need to stop dating fat women.
Also, fuck you, cunt, you kike ass nigger pussy. You're a fucking deadbeat loser, eat my shit and rot. You need to understand what wikipedia means to me. Nothing. By nothing I mean I'd rather be penetrated by razor sharp dildos, into my sphincter, before ever giving a shit what you do. Suck my cock you white pow wow nigger knife kike, AND AND AND eat my shit. Seriously. I mean this for real. EAT it. Meaning, stick the lumps of excetement escaping from my rectum and consume them, let the shit slide down your throat. Then, and ONLY then, may you disgrace yourself by giving me the shitty head you're really unqualified to give.
Dog Fucker.",1
2012,"My Name Md Ramijuddin , Father Name Md Abdur Rashid Born 15 march 1994 at Kaliachak, Malda, My website Name Is Www.Ramizwap.tk Visit My Site",0
2450,"GIRL ABOUT TOWN: Victoria Beckham is preparing for a fifth baby

Victoria Beckham, right, is preparing for a fifth baby with husband David, according to sources close to her best friend, Tana Ramsay.

Victoria, 42, has confided she's boosted her already spinach-heavy diet with broccoli and leafy greens rich in folic acid.

After years of resisting another pregnancy, it seems Victoria is ready to join the 'just one last baby' club of the rich and famous.

Tana, 41, wife of chef Gordon, is expecting her fifth as is Jools Oliver, 41, wife of chef Jamie. David has been keen on a fifth since daughter Harper was born in 2011.

Meanwhile, I can reveal that three years after retiring, David Beckham has ventured back on to the football pitch – as a referee.

The former England captain has twice been called up to referee after-school matches for his 11-year-old son Cruz's team in West London.

On the first occasion, when the original referee failed to turn up, the coach asked an American parent to do the honours, but he responded: 'Are you kidding me, I'm standing right next to David Beckham!'
",2
2629,"Gave up weed for pregnancy? Miley Cyrus, Liam Hemsworth reportedly trying for twins

Singer Miley Cyrus and actor Liam Hemsworth are reportedly trying for twins. The couple reconciled in early 2016.

The Last Song co-stars are believed to be “super excited” for Cyrus to be pregnant, reports OK Magazine.

“Miley and Liam just love that family dynamic and Miley is desperate to give Liam a child and figures why not go for twins,” said a source.

“The couple has looked into IVF to increase their chances, and they’re both super excited. A boy and a girl would make Miley’s happiness complete,” the source added.

Cyrus has also given up alcohol, weed and other drugs in order to have a healthy pregnancy.

The Wrecking Ball hitmaker also released a new single Malibu, which is dedicated to Hemsworth.
",2
1972,"""
(after edit conflict with User:Jason Potter - The WP:3RR suggests that the 4th revert is the one not allowed, but also mentions that it is the spirit of the policy, rather than the exact letter, that is enforced. With regards to the section of this talk page Ymous quoted, I did not miss that part. I also did not miss the sentence directly after it, which states """"This """"Discussion"""" page is only for discussion on how to improve the Wikipedia article.""""
In other words, the section quoted relates directly to the talk page, not the article.  
""",0
358,"Kathryn Bigelow is a patriot who makes great war films. She set out to make an action film about the hunt for Bin Laden years ago. Then President Obama made a tough call and got the guy. Now the right wing propaganda machine seeks to negate the boost to Obama's image by making a political football out of Bigelow's film. This year has seen a huge, funded effort by the Super PAC propagandists to spread propaganda through social media and this article, not to mention the OPSEC fraudsters is a great example of that. Leave Kitty B's patriotic film alone, you flaming assholes!",1
482,"""Niggers and their liberal friends steal everything not tied down, just like the presidency here with acorn with its liberal defenders, FUCK YOU NIGGER """"OBAMA""""!!

""",1
108,"""

 Threats 
Please refrain from using threats to other users. """"A revert of this will take you directly to Wikipedia arbitration."""" What is this? Mr. Oh-you-better-follow-what-I-do-or-I-will-ban-your-ass?

Don't be a jerk.

  """,1
2392,"Well, sometimes people tend to forget that this place is an encyclopedia, not a gossip site. Colin is one of my favorite rally idols and I really hope he's still alive.",0
1608,"This song was coverd by Paul Torrence, Tanner Viox, The Banjo sisters, and The super BEbop Boys featuring Al Gore.",0
1109,Jeff G. ツ likes to rape goats while illegal aliens choke him and shove broken glass in his ass.,1
2658,"This Is What Brad Pitt Has Been Texting Jennifer Aniston

It has been six months since Brangelina (that's Brad Pitt and Angelina Jolie for anyone who has been living under a rock for the last twelve years) announced their split. The couple famously met on set of Mr & Mrs Smith in 2004 while Brad was already married to Friends star Jennifer Aniston, and they sparked a media frenzy when Brad left Jen and pursued a relationship with Ange a short while later.

It might sound like an EastEnders-worthy love triangle, but it was all very real for Jen, and Brangelina happened for a good thirteen years before it suddenly broke down at the end of last year.

But anyone gunning for a friendly reunion between Brad and Jen (is Bren a thing?) after all these years may finally get their wish, as it has been reported that the two are 'texting' amidst Brad's divorce from Angelina.

According to US Weekly, Brad reached out to Jen to wish her a happy 48th birthday in February and the former couple started making baby steps to rebuilding their broken relationship.

A source told the publication: 'They started talking once he wished her a happy birthday.

'Brad's told her he's having a hard time with his split and they exchanged a few texts reminiscing about the past.'

However, anyone hoping that Bren is going to happen again will be sorely disappointed. Jennifer has been married to Justin Theroux since 2015 and the source confirms that Justin is more than happy for his wife to be in contact with her ex.

'Justin is okay with them being friends [as he knows] Jen just wanted to be nice,' the source said.

We're so glad that these two are finally in a place where they can be friends again (ahem, pun intended).
",0
1351,"Referring to her as *Catherine* 

I was told in no uncertain terms that I could NOT refer to anyone, living or dead, by their 1st names on WP, & if a female had a title, she had to be referred to as that throughout her article - ie, *Lady Amy* or *Lady Dudley* for Amy Robsart, even though *Lady Amy* was wrong before she was married as she was the daughter of a knight & had no title, & wrong after Northumberland was attainted & all his children lost their styles as offspring of an earl & a duke, & she did not become *Lady Dudley* until Elizabeth I knighted Robert Dudley near the end of Amy's life nor was she then *Lady Amy Dudley* as legally she was no longer the wife of the son of an earl & duke.  I thought it was simpler to refer to her as just *Amy* throughout rather than explain the changes that occurred with her name & styles, but was told it was against WP *rules* (though I wasn't pointed to a link for it).  Noblewomen are usually called by their 1st names round here as far as I can see, even when they have surnames & are not *of* something!  Mary Boleyn is called *Mary*, not *Lady Carey* or *Lady Stafford*, Catherine Neville is called *Catherine* & not *the Duchess of Norfolk*, etc, & they're not royals.  

As for males, I was told they had to be referred to by their title - ie, *Leicester* -  or last name - ie, *Dudley*.  I was banging head on keyboard going, but - no one just says *the king* all the time or refers to them as *Plantagenet* or keeps changing their titles - ie, Henry of Bolingbroke going from Earl of Derby to Duke of Hereford to Duke of Lancaster to King of England -  

So how does Kate get to be consistently referred to as *Catherine* throughout the article, without her title appended?  I've only been here a few months & I would appreciate it if someone could actually explain this to me, as my main interest is British history & I am quite confused.",0
2842,"Jennifer Aniston wants to set up a wellness centre

Jennifer Aniston wants to open a wellness centre in the future. The space would house treatments, as well as a healthy cafe.

""My dream is to open a wellness centre. I have a fantasy where you have this beautiful space with facialists, rotating workouts, meditation classes, and a café with recipes that are healthier versions of delicious foods so you're not deprived,"" she told US Harper's Bazaar.

""I'm working on it in my brain. Not to sound all woo-woo, but if you go out into the world with inner peace, you're more joyful. There's a life's-too-short policy that I now have with my work; no negative Nancies. So I'm looking forward to my facial.""

Aniston also shared her surprising tanning method - and, guaranteed, you probably have this ingredient at home.

""Yes, [I use] baby oil and Coca-Cola, or some weird combination,"" she says. ""Being Greek, we love our tanning, but I've been on hiatus. And I miss it. It brought me a lot of happiness being able to lay out there and get that vitamin D, but I've become very comfortable with a good spray tan.""

Her friend and comedian Amy Sedaris, who conducted the interview, also shared her memories of Aniston's wedding to Justin Theroux.

""Everything about that wedding was perfect,"" said Sedaris. ""Everyone was dressed like a bunch of woodland creatures, and your dress looked so beautiful and breezy. Justin [Theroux] asked me to be his best man two days before, and I was really scared. Jimmy Kimmel [who officiated at the nuptials] said, ""Amy, you have one job: Just hand me the rings separately."" Of course, I handed both to him.""
",0
471,"""""""Wikipedia is a free online encyclopedia that can unfortunately be edited by dopers,
children,felons,feeble-minded people,morons, fools and worse.""""  Marcus Smerf

""",1
407,"is dope you.  Hey Rick James, leave Rick James alone",1
253,"AGAIN
Every edit I did to the Jackie chan movies of the U.S Versions of how many minutes were cut are correct and you cocksuckers revert back to the original versions, you better back off or I will sue you.",1
1331,"""

Please do not accuse members of vandalism. I do not mind if you change the word unique to prominent or remove stories of dreams etc. but you have vandalised the page and made a statement biased by saying that Dr. Qadri """"only"""" sent out a referendum so I reverted the whole edit. You have also reciently vandalised the page by removing the names of the Yemeni scholars who recieved Dr. Qadri's Ijaza including the pictures and this is a clear form of vandalism so before accusing other members of vandalism do not vandalise the page yourself. What I did was clearly not vandalism as I only reverted your edit and any changes you made and brought the page back to its previous form. So would you first kindly read the rules of wikipedia and find out the definition of vandalism before accusing experienced users. You are still new to wikipedia I'm afraid and you need to learn how it works and the different rules of wikipedia before making any further edits.   """,0
1834,"A photograph of John D. Terrell, Sr. 

Does anyone here know where we can obtain a photograph of the said John D. Terrell, Sr.?",0
2528,"Caitlyn Jenner and O.J. Simpson Are Set to Reunite on TV: ""It Would Be Fascinating!"" (EXCLUSIVE)

It’s hard to get much more sensational than this: a TV show pairing the world’s most famous transgender celebrity with the world’s most famous acquitted murder suspect — especially when both have connections to the Kardashians! Life & Style has exclusively learned that TV producers have come up with an idea to bring O.J. Simpson and his old pal Caitlyn Jenner together in a televised reunion.

The former football star, 70, who was acquitted of double homicide in 1995 and completed a nine-year prison stint on Oct. 1 for a 2007 armed robbery and kidnapping, has known Caitlyn, 68, since she was Olympic gold medalist Bruce. They also share the Kardashian connection: Long before Caitlyn married into the family, O.J. was best buds with Kris’ first husband, Robert. O.J. should be interested in the show, a source says, but there’s a snag: Caitlyn has “wanted nothing to do with O.J.” since the NFL star was charged with murdering his ex-wife Nicole Brown Simpson and her friend Ron Goldman.

Though they haven’t approached her yet, producers are hoping to convince Caitlyn to sign on by pitching it as “an informative, interview-type show,” the source says, in which she introduces O.J. to the new Caitlyn and asks him probing questions about his ups and downs. “If they do it right,” says the source, “it would be fascinating.”

And while the public, might be hesitant to watch such a reunion, the producers are convinced plenty of people will tune in to view the show. “Love them or hate them,” says a source, “putting Caitlyn and O.J. in the same room would be must-see TV.”
",2
999,"You're both morons.  David Levy, you're the ONLY person with a problem with the move, so I'm not sure what consensus you're referring to.  Scorpion, relatively popularity is meaningless.  They both have the same name.  Ergo, there should be a disambiguation page.  Since neither of you seems to have a clue, I'm not going to waste my time here anymore.  Good luck with your fan page, idiot.  And good luck with your fascism, Levy.",1
1916,"(UTC)

[Scriptural Evidence] Volume 7, Book 62, Number 64: Sahih Bukhari [the most venerated and authentic Islamic source] Narrated 'Aisha: that the Prophet married her when she was six years old and he consummated his marriage when she was nine years old, and then she remained with him for nine years (i.e. till his death).72.225.231.210  20:16, 26 July 2009",0
1739,"""

 Section needs to be edited 

This line about New Hampshire is not very accurate:

On January 17, 2000, for the first time, Martin Luther King Day was officially observed in all 50 states.[4] Prior to that New Hampshire and Arizona did not observe the day.

In fact, New Hampshire passed """"Civil Rights Day"""" in 1991, to honor Dr King, and other civil rights activists like Rosa Parks and Malcolm X.  Since the article states clearly that other states, such as Utah, have different names for the holiday, including combining it with Confederate military heroes, this sentence does not seem justifiable.  The article leaves the impression that New Hampshire was some sort of bigoted state, that was one of the last to recognize this holiday.

I am a newbie to Wikipedia, how do we fix this?""",0
2343,"""

Requests for comment
I've echoed the suggestions of Mackensen and others that you take this to Wikipedia:Requests for comment.  Your most recent reply on Mackensen's talk page is:

 I could, but I think Arbcom should accept the case with or without an RfC. There's too much misconduct to willfully ignore. Besides, you're only asking me to do that to delay the inevitable, why would I ever take that advice?

There are several problems with this response:
 Firstly a number of other editors have asked you to go through RfC: , the  closer or the first Articles for deletion discussion, , who as far as I can tell played no part in earlier discussions,  who also seems to have been absent from earlier discussions, and , an arbitrator who in rejecting the case said """"If you can't be bothered with an RfC then we can't be bothered with an arbitration case.""""  has also remarked on your failure to follow process here.
 Again you allege misconduct, on a scale too great """"to wilfully ignore"""".  If there appears to be such a level of misconduct and yet the arbitrators can't see it, it looks like you'll have to make it more apparent to them.

But finally, despite all the others including arbitrators who have asked you to go to RfC, you say that I in particular am only asking you to go to RfC """"to delay the inevitable"""".  Well I'm not sure that you and I can agree on what """"the inevitable"""" is in this case.  To my eyes this looks a case on which you really wouldn't like to hear what the arbitrators have to say, and they've hinted on this in their comments on the case.  But since they're obviously not going to accept the case until you've at least made an honest attempt to conduct some intermediate steps in dispute resolution, I'm urging you to do so.  If an arbitration case follows, the sooner the better as far as I'm concerned, so get cracking. Tony Sidaway """,0
952,"Nick GaS is coming back! 

It's coming to the UK! 
Cyphoidbomb is gay! 
It's coming to the UK! 
Cyphoidbomb is gay!",1
