,Comments,label
1680,"""

Hello Barto. I am curious as to what your motivation is in editing on the Ron Gostick page and are you the creator of it?  As stated on the talk page there, you are correct in stating that internet sources which are few come from mostly the extreme right or left.  These are terms both I and Ron, himself would acknowledge as being artificially misleading characterisations and could not be ascribed to him or the associates of the Canadian League of Rights. I could explain why here, but I won't bore you with the details.

However, I do reject the notion that everything must link to a Wiki article.  I am editing at another page, where there is no objection to verifiable external sourcesinternet or hard copy. I will not object to so-called Left or Right sources, as long as there are sources from external links to associations and people connected to Mr. Gostick.  The archives at the Australian League of Rights will have plenty of published materials on him, League objectives and views or anyone associated with him. This is one link that was removed in favor of David Lethbridge's document (hardly a non-politcally unbiased character considering he represents everything the opposite of what Gostick and the League of Rights stood for).

I will try to help you find sources, fair and credible in the near future, doing edits myself.  I just want to know if you have a bias of your own or are willing to be neutral on some claims made about him.  I know well what he and the League of Rights stand for, as I have been involved with it for near 30 yrs. There is no denying he was anti-totalitarianism and that includes anti-zionist, which automatically brings down the bogus smear of """"anti-semitism' and other such nonsense.  An editor should have at least some familiarity with the subject he is decidedly determined to write about.

I have notified Paul Fromm of the wiki page and link to him at Gostick's page, in case he didn't know it existed.  Be aware that Wikipedia has come under criticism for pages created on living persons, edited by vandals with damaging false claims unknown to the subject of the article until much later.  One was a recent high-level member of the Kennedy administration and believe me he made a public stink about it.  Living or dead, I don't care to see this happen to anyone. 

Feel free to post at my page in answer if you wish.  Do you have a wiki email or a private one? """,0
332,"Jéské Couriano  is a stupid faggot!!!! 

Jéské Couriano  is a stupid faggot!!!!Jéské Couriano  is a stupid faggot!!!!Jéské Couriano  is a stupid faggot!!!!Jéské Couriano  is a stupid faggot!!!!Jéské Couriano  is a stupid faggot!!!!Jéské Couriano  is a stupid faggot!!!!Jéské Couriano  is a stupid faggot!!!!Jéské Couriano  is a stupid faggot!!!!Jéské Couriano  is a stupid faggot!!!!Jéské Couriano  is a stupid faggot!!!!Jéské Couriano  is a stupid faggot!!!!Jéské Couriano  is a stupid faggot!!!!Jéské Couriano  is a stupid faggot!!!!Jéské Couriano  is a stupid faggot!!!!Jéské Couriano  is a stupid faggot!!!!Jéské Couriano  is a stupid faggot!!!!Jéské Couriano  is a stupid faggot!!!!Jéské Couriano  is a stupid faggot!!!!Jéské Couriano  is a stupid faggot!!!!Jéské Couriano  is a stupid faggot!!!!Jéské Couriano  is a stupid faggot!!!!Jéské Couriano  is a stupid faggot!!!!Jéské Couriano  is a stupid faggot!!!!Jéské Couriano  is a stupid faggot!!!!Jéské Couriano  is a stupid faggot!!!!Jéské Couriano  is a stupid faggot!!!!Jéské Couriano  is a stupid faggot!!!!Jéské Couriano  is a stupid faggot!!!!Jéské Couriano  is a stupid faggot!!!!Jéské Couriano  is a stupid faggot!!!!Jéské Couriano  is a stupid faggot!!!!Jéské Couriano  is a stupid faggot!!!!Jéské Couriano  is a stupid faggot!!!!Jéské Couriano  is a stupid faggot!!!!Jéské Couriano  is a stupid faggot!!!!Jéské Couriano  is a stupid faggot!!!!Jéské Couriano  is a stupid faggot!!!!Jéské Couriano  is a stupid faggot!!!!Jéské Couriano  is a stupid faggot!!!!Jéské Couriano  is a stupid faggot!!!!Jéské Couriano  is a stupid faggot!!!!Jéské Couriano  is a stupid faggot!!!!Jéské Couriano  is a stupid faggot!!!!Jéské Couriano  is a stupid faggot!!!!Jéské Couriano  is a stupid faggot!!!!Jéské Couriano  is a stupid faggot!!!!Jéské Couriano  is a stupid faggot!!!!Jéské Couriano  is a stupid faggot!!!!Jéské Couriano  is a stupid faggot!!!!Jéské Couriano  is a stupid faggot!!!!Jéské Couriano  is a stupid faggot!!!!Jéské Couriano  is a stupid faggot!!!!Jéské Couriano  is a stupid faggot!!!!Jéské Couriano  is a stupid faggot!!!!Jéské Couriano  is a stupid faggot!!!!",1
1885,"""
And I've left some advice and links. Btw, you did an astonishingly good job breaking down what was wrong with the edits to R&I; - that was a lot of work, and I thank you. I was dreading that when I got back today. Chihuahua """,0
2391,"""

""""The Big Show"""" IS the correct answer! And it was performed by Chapman & Baker. I had an audio only copy of the sketch , but not the full show ... Bob Hope could've been hosting , but had nothing to do with the sketch. ( A further version of the sketch exists performed by  John Cleese & Connie Booth on the album """"The Mermaid Frolics"""". )  """,0
1420,"""
""""Krauss plans to update The Physics of Star Trek in 2006.""""

I think this article needs to get updated...""",0
1294,"Sarek of Vulcan: Unfortunately for you, you cannot ban a fact. 

Sarek of Vulcan: Unfortunately for you, you cannot ban a fact.

Fact: Lawrencenkhoo told me here on Wikipedia that companies keep their retained profits in the bank. 

Fact: That is absolutely untrue.

Fact: Sarek of Vulcan bans me for stating that. 

Fact: Sarek of Vulcan can ban me but cannot ban facts.",0
1138,"Don't be a Dick
You know what you did, don't do it again. You weren't making test edit or anything even slightly like that. Fuck off. 94.195.251.61",1
927,"You are not cool 

You are the most hated fool in the world! You are a load of %$#! Barry Dejay rocks!",1
2055,"One last issue Roger as I am trying to listen and learn.  I see where you made corrections but when you click the highlighted wikilink names there are no wiki pages for them (ie Rhythmic Arts Project and Saving K-9 Lives), only pages to create, and that is why I used the external links instead, since they mention Tamara on those websites. Perhaps it is perceived as redundant since I mention them in the external links.  thanks again for all mary",0
2793,"Miley Cyrus and Liam Hemsworth wore wedding rings on 'SNL' — and now fans are convinced they got married

The couple were in a ""Saturday Night Live"" sketch together. Saturday Night Live/YouTube

Miley Cyrus and Liam Hemsworth have sparked some speculation that they got secretly married after stepping out with rings on their fingers in late October, and the engaged couple continued to fan the flames on ""Saturday Night Live.""

Cyrus, 24, performed two songs as the musical guest on Saturday's episode of the NBC sketch show. Her ring finger was especially noticeable during ""I Would Die For You,"" her second performance of the night.

Miley is still sporting two rings. Saturday Night Live/NBC

Hemsworth, 27, surprised fans with a cameo in a ""The Price Is Right"" sketch earlier in the night, but his left hand was covered throughout the whole thing. But at the end of the evening, as everyone clapped and said good night, a band could be spotted on his ring finger.

Some eagle-eyed fans spotted the rings on their fingers.

Now, this isn't the first time both have stepped out with bling on their ring fingers.

Back in August 2017, Hemsworth was spotted with the gold band on his finger, but sources told E! News that the ring was worn as a ""'promise' to Miley."" As for Cyrus' rings, she began wearing her engagement ring that Hemsworth first proposed with in 2012 after the two reconciled in 2016. She was spotted with a second ring on the finger in October, according to Glamour.

But Cyrus has spoken about her views on marriage, and doesn't seem too keen on tying the knot just yet.

In a recent interview with The Sun on Sunday, according to a report from The Daily Mail, Cyrus said she wants to wait a bit before getting married.

""I don't envision marriage. I'm 24. I hope I get to live a little bit more,"" she said. ""I have too much living to do [before I get married]. I have no idea what the next three years will bring, but if it's possible to get even happier, I'll take it.""

For an in-depth look at their whirlwind romance, read our relationship timeline.

",0
2691,"Selena Gomez And Jennifer Aniston Double Date: Jen's Comments About Weeknd Were Lies

Selena Gomez is currently dating The Weeknd. Her bestfriend Jennifer Aniston is supportive of her but their relationship is sometimes targeted by rumor mongers.


Selena Gomez and Jennifer Aniston were reported to have planned for a double date with their respective partners after The Weeknd's tour wraps up. The ""Hands to Myself"" singer was also reported telling that her BFF has given her advices on her new relationship. But fans of Justin Bieber's ex-girlfriend should not rejoice over the reports because they were declared as all lies.

According to Gossip Cop, the above-mentioned reports were found out to be all false and the source of the news was merely fabricating stories. The site which is out to expose hearsays and false reports about celebrities has verified the said reports.

The news that was published by Hollywood Life dated March 23 states that the ""Mother's Day"" star was excited for her little sister's new beau and she was grateful that she has found peace in life. She was reportedly proud of her and of what she has become. They were already talking about the planned double date as alleged by the report. Gomez was reportedly spending time with her boyfriend's family.

In another report from the same source dated January 17, 2017, it states that the ""Horrible Bosses"" actor has told the ""Kill Em With Kindness"" singer to follow her heart and that the Justin Theroux's wife was giving love advices to Selena Gomez.

Well, with the reports on Aniston's reactions about her friend's love life being debunked, the only reliable source would be people close to Gomez and since they have not publicized anything, it is best to take everything with a grain of salt. Regarding the double date, the probability that it will happen is nil at the moment but who knows, it might happen in the future.

The Weeknd and the 24-year-old former Disney star's relationship became controversial after it was revealed months back. The rapper has just moved on from a relationship with Bella Hadid and the model even warned her ex-boyfriend about Gomez. She said that the ""Same Old Love"" singer was only using him for her career.

Selena Gomez declared that she is determined to make their relationship work and denied all the negative comments about her. The singer, who has successfully dealt with her emotional issues due to her Lupus, is now happy supporting her boyfriend. She was seen at the rapper's concert in Brazil recently.
",0
1620,"G'day Fayssal 

Hope you're good -) - I must also take this opportunity to let you know that almost every time I see your username around the place, I get that catchy 80s electro tune in my head - your very own soundtrack -)

What brought me here really though was your comment in the arbitration amendment thing that someone filed about 'my' case - it's all kind of a long time ago now, of course, but I did (and do) find the irony of  having run '' as a long term sock rather delicious - the fact that Guy ran these two accounts all came out ages ago too, if you're a curious wiki-historian (or have present concerns, I guess?) then let me know if diff.s would be handy, otherwise I just felt it was worth clarifying what I was on about -) cheers,",0
2585,"Kelly Ripa and Megyn Kelly in a Ratings Battle Over 'Megyn Kelly Today' and 'Live With Kelly and Ryan'

Things are getting heated! Megyn Kelly Today and Live With Kelly and Ryan air during the same time slot (weekdays at 9 a.m.), so it's no surprise there's a ratings battle going on between hosts Megyn Kelly and Kelly Ripa right now!

According to Life & Style, the shows were neck and neck with numbers during Megyn's first day in late September. At that time, Megyn very closely beat Kelly and Ryan by 172,000 viewers (2.932 million vs. 2.760 million). The best part for Megyn? She outnumbered them in the prime age demo: 25 to 54.

However, after a few bad interviews (who could ever forget the Jane Fonda and Will & Grace cast mishap), Megyn's ratings have gone down by 14 percent, which means Kelly and Ryan have taken the lead back. And the Today execs are totally not happy about it. ""Megyn just doesn't come across to the viewers as authentic,"" a network inside told Life & Style.

Things have been difficult for Megyn since her NBC debut. At this point, she's even having trouble getting A-listers to appear on her show. ""Megyn hasn’t been able to book any big-name stars that haven’t been on Today during the first two hours,"" a source told In Touch. ""Hollywood hasn't exactly put the welcome mat out for her. Megyn has left a lot of people cold.""

Debra Messing Megyn Kelly Getty Images

Megyn's awkward interview with the Will & Grace cast. (Photo Credit: Getty Images)

Viewers were also surprised to learn that Megyn wouldn't be talking about politics on the show (she famously came from FOX with a background in politics). ""They spent all that money on this great political anchor and journalist,"" an insider told Page Six. ""If you take those things away, what are you paying for?"" Fans are going to have to continue to tune in to Megyn Kelly Today to see the fate of the show...
",2
2645,"Halle Berry sparks pregnancy rumours after displaying baby bump on red carpet

Halle Berry, 50, has sparked rumours she is expecting her third child after debuting what looks like a ‘baby bump’ on the red carpet at the 16th Annual Chrysalis Butterfly Ball in Los Angeles.

The Oscar-winning actress looked stunning in a clinging silver sequinned dress and matching heels and posed for cameras with her hands on her tummy as though protectively cradling her ‘bump’.

Halle has yet to announce she is pregnant but when she turned to the side the bump was prominent in her dress and Halle seemed happy to show it off.

The star is not known to be dating anyone and last week posed on Instagram in a top that read ‘No more boyfriends’.

She captioned the photo: ‘Summer’s coming… let’s shine up our crowns ladies!’

Last night social media went into meltdown with speculation of who the baby daddy may be.

The Oscar-winner has two children already, having given birth to her second at the age of 47.

Halle had previously thought she was perimenopausal when she discovered she was pregnant with son Maceo to her French actor husband Olivier Martinez, who she divorced in December 2016.

The bump was even more prominent when Halle posed to the side [Picture: Splash] She has a nine-year-old daughter Nahla to Gabriel Aubry from a previous relationship.

Back in 2014, Halle said she was shocked to find out she was pregnant at 47.

‘They call it a geriatric pregnancy,’ she said at the time.

‘I was, you know, on my way … this is probably way TMI, but I was really, you know, kinda premenopausal so to have this happen was a huge [shock].’

‘I mean, I didn’t think it was possible to have another baby … So, I’ve learned never to say never.’

If she is she will be in good company as Janet Jackson recently gave birth at 50.

Or maybe Halle is playing us all along and it’s just a food baby in there…

",2
2332,"I think John Waddy will end up as a dab page, neither seems to be able to claim obvious pre-eminence.  We could always see if Steve is prepared to hold off putting his guy live until you're in a position to do yours, bu tit's probably not really worth it. Just be quite fun to continue the coincidence.",0
1662,"Vandalizing the Macedonian towns 

Freestypefrappe, I will not stay calm until you stop vandalizing the Kumanovo page talking only about murdering, blood, terrorism and nothing about the city normal life. Of course, there were moments in the Kumanovo’s history when a terrorist attacks took place, but Kumanovo is most of the time a quiet ordinary Macedonian town that doesn’t deserve such descriptions.  It is the same as if you write an article about London not mentioning St Paul’s catedral, Westminster, Tower bridge.. and writing only about recent terrorist attacks in the London underground. Talking about copyvios, I noticed that you are using text written by Christopher Deliso.  I found that on the following sites:
http://www.serbianna.com/columns/deliso/
http://www.popovashapka.com/terrorist_bombing_in_kumanovo.htm
Do you have permits for doing that?",0
153,"""

The Administrator Kafziel is an asshole! (Sorry for writing that on your page User talk:76.199.9.176 but it is true) Join the revolution that fights for freedom of speech against the tyranny of wikipedian administrators, especially the evil dark lord/fuck head Kafziel from your fellow blocked vandal/ freedom fighter: Ernesto Guevara de la Serna.

""""""""Hasta La Victoria Siempre""""""""""",1
2487,"EXCLUSIVE COVER STORY: MICHAEL DOUGLAS $300 MILLION DIVORCE

Michael Douglas and Catherine Zeta-Jones' marriage has exploded again – and it may be over for good, The ENQUIRER has learned exclusively from insiders.

After a separation and a bid at reconciliation, the ""Wall Street"" star, 70, angrily ""walked out"" on his wife, 45, sources say.

""This time around, you may be hearing from my divorce lawyer!"" Michael ripped into the ""Chicago"" beauty, according to an insider.

Revealed the source: ""Michael won't give up on this marriage easily. Remember, this is a guy who battled back from deadly stage 4 tongue cancer!

""But it takes two to make a marriage work, and Michael's feeling is that Catherine has 'checked out.' So nothing is stopping him from throwing in the towel, too.""

The couple had a ""big blow-up"" before Michael headed off to work on  new film ""Ant Man"", said the insider, adding: ""He is preparing himself for the possibility of a $300 million divorce in 2015 if they can't work out their differences.""

In March 2013, The ENQUIRER exclusively broke the bombshell that the couple had secretly split in a ""hush-hush trial separation."" Five months later, their reps confirmed the breakup before the two tried to reconcile.

When contacted now, their individual reps deny the couple's 14-year marriage has ruptured again, but sources allege it's secretly been on the rocks for months!

""Turning 70 was a big accomplishment for Michael after surviving cancer, but Catherine refused to do any public celebrating with him,"" said the insider. ""Michael was so ticked off, he let her know it, causing a massive fight between them. ""He told her, 'I've had enough!'""

FOR THE FULL STORY with ALL the details – it's ONLY in the new ENQUIRER – on sale now!
",2
2694,"Gwen Stefani Will Reunite with Boyfriend Blake Shelton to Coach The Voice Season 12

The pop star will be reunited with boyfriend Blake Shelton as well as longtime coach Adam Levine for the twelfth season of the NBC singing competition, the show announced Tuesday. Rounding out the celebrity panel is current coach Alicia Keys.

Stefani, 47, and Shelton, 40, famously met on the seventh season, and it's almost been a year since the pair went public with their romance during the ninth, while they were recovering from divorces from Gavin Rossdale and Miranda Lambert, respectively.

The couple also performed their duet ""Go Ahead and Break My Heart"" for the first time on season 10.

Throughout the show's 10 completed seasons, team Blake has a total of four champions with team Adam following closely behind with three wins. Past coaches Christina Aguilera, Usher and Pharrell Williams all have won one season.

New coach Miley Cyrus has also signed back on, but for season 13, premiering next fall.

Season 12 of The Voice will begin in February 2017.
",0
146,"Yarrr! 

Heil Hitler, matey!

You're invited to comment on the FAC of the article on Kronan.

And that goes for anyone else skulking around this talkpage. Go on. Do your worst!

 A little gift  

I stopped by just to say Thank You!  D   talk",1
121,"Don't act OK. I know Sadasivan's works. His only ambition in his life was to degrade Nairs. What the fuck you think is the meaning of that passage? I am just asking you, if the word Nair came from the word dog, then give me a secondary source supporting that, other than that from the mental case Sadasivan.",1
1913,"""

 Whole Ariticle Needs to br Rewritten 

i believe this whole article needs to be rewritten fromntop to bottom.  In jumps around in a chronological sense, thereby notbshowingbin a cohesive way how improvisational theatre has developed.  There is a lot of text devoted to thevwork of Keith Jonstone, but his work is no more important than dozens of other writers; moreover, his importance is no where near as significant in the US as is the work of Spolin, Shepherd, Sills, and Close (and the rolenof IO and The Second City.

The article, in it's present form, looks like a hodge-podge of sentences and paragraphs from many authors with no attention paid to consistency.

A rewrite would also avoid some duplication.

How does one initiate such a process?  Who selects the person to take the first stab at it?  I would propose that Michael Golding of Los Angeles do the rewrite.  He has a masters degree in improvisation from NYU, personally knows many of the people who have created modern improvisational theatre (Shepherd, Sills, Close, Halpern to name a few), and is a professional writer (his latest credit is for writing the film """"David Shepherd: A Lifetime of Improvisational Theatre"""").  Any thoughts?""",0
1985,"""
I changed my mind and did change it after all, seeing as this article doesn't appear to be all that well kept. I also removed the reference to """"Sean"""" redirecting to this page, since it doesn't.  """,0
2373,"I think Alex had it planned from the beginning to form some sort of group page on a user space page to make it clear that we were working in a group.  Possibly having some sort of template on all of our user pages may be a good idea, as I am a wiki sysop for other websites, and I try to do things to minimize the look of conspiracy or sock puppetry.  I will remind everyone to keep as much communication as possible on this site, to prevent appearance of sock puppetry or conspiracy.  Also, just because you say you don't communicate with other users who come to your defense, highly conveniently, as I have been told, as there are many other ways to communicate off of this website; I keep this in mind when dealing with other users and policy on the websites I administrate.

I think it's important to add that I don't agree with a lot of what Alex says, and that I'm not here to be a robot for her cause.  I may consider myself independent from her group for this reason.",0
1418,"Effects under £3000 - dated 3rd June (with one codicil) of Charlotte Dorothea Forster Grierson, formerly of the city of Dublin, afterwards residing at four Clarmont Bank, Shrewsbury, England & late of Carlile-terrace, Malahide, County Dublin, Ireland, Spinster deceased who died 6th March, 1869 at Carlile-terrace, aforesaid was proved at the Principal Registry by the oath of George Abraham Grierson, of Manor House, Malahide, aforesaid Esquire, the sole executor,",0
259,"Like i would listen to you, you are a loony dickhead who reverts everyone's edits, Alex: too.",1
2765,"
Kim Kardashian on How the Aftermath of Her Robbery Inspired Her New Crystal Gardenia Fragrance (Exclusive)

There’s more to Kim Kardashian West’s newest fragrance, KKW Crystal Gardenia, than meets the eye!

The 37-year-old reality star and businesswoman is launching her new scent on Wednesday, and this time it’s personal.

“After my whole Paris situation over a year ago, all my friends would come over and bring me healing crystals,” Kim told ET’s Keltie Knight in an exclusive interview. “I wasn't really into them. I didn't know much about them. Enough people brought them over that I love the shape, I loved holding it, and I felt like, ‘OK, this is it. I want something that I feel like calms me, is healing...’ And I wanted the bottle, especially the smaller one.”

The mother of two wanted the crystal-shaped bottles to bring her fans a similar calm.

“It felt so pure to me,"" she noted. ""I just loved [how] the properties of the rose quartz and citrine bring happiness, and it just meant so much to me to look into what crystals mean and their healing properties.”
",0
274,"Sesond attack for ToonLucas22
, you're a fucking shit, stop blocking me, Fuck you, since my account named Morty Smith 2.0 was blocked.",1
1661,"The Billy the Kid article with my contributions has been vandalized on or about Dec. 14, 2015 by someone calling themselves KrakatoaKatie. What had been the most detailed, and accurate account of Billy the Kid's life has been replaced with pure garbage. I ask every to look at the last version I submitted one concerned and compare it to what it has been replaced with. I ask anyone who is knowledgeable about the subject, and who doesn't have some sort of agenda, to take a look at what has happened and let your feeling be known. Thank you.",0
