,Comments,label
815,"""

WP:BURDEN is with you. '''''' Dick Laurent is dead """,1
1618,"It is important as it was by the means of this contest that Colombian artists like Fernando Botero, were able to travel outside colombia and florish as well as to gain name recgnition in Colombia. ( )",0
2828,"https://www.vanityfair.com/style/2017/09/jim-carrey-roasts-fashion-week
Jim Carrey Attends Fashion Week Party Just to Roast Fashion Week Parties
2017-09-11
Jim Carrey, once an actor, now an artiste, and cultural commenter, stopped by New York Fashion Week to neg it. E! News’s Catt Sadler caught up with Carrey on the red carpet of the Harper’s Bazaar Icons party Friday night, and the two-minute clip of their exchange has been percolating on Twitter ever since. After she pointed out that she’d never seen him at the biannual spectacle, he explained to her the following: “There’s no meaning to any of this. So I wanted to find the most meaningless thing that I could come to and join and here I am.” Watch Sadler’s eyes as she fully comprehends what she’s about to endure.

“Celebrating icons,” Carrey says. “Boy, that is just the absolute lowest aiming possibility we could come up with. Do you believe in icons?”

When Sadler started to answer, he interjected, “I don’t believe in personalities. I don’t believe that you exist, but there is a wonderful fragrance in the air.”

Carrey then looked in the camera and gave his speech, “I don’t believe in icons. I don’t believe in personalities. I believe that peace lies beyond personalities, beyond invention and disguise, beyond the red ‘S’ that you wear on your chest, that makes bullets bounce off. I believe that it’s deeper than that. I believe we’re a field of energy dancing for itself, and—uh—I don’t care.” (It wasn’t exactly extemporaneous poetry; the lines are borrowed from a commencement speech he gave in 2014 at Iowa’s Maharishi University of Management).

Yes, he sounded like a liberal-arts student on a particularly mellow week night. And it’s not clear whether he sensed the irony in himself saying all of that while attending the party and wearing a flashy tailored suit (Asked about his get-up, he said, “I didn’t get dressed up. There is no me. There’s just things happening.”).

Carrey’s referendum, despite its slightly unbearable pitch, rings somewhat true amid the backdrop of destruction caused by Hurricanes Harvey and Irma. And Charlottesville. And the general mood of melancholy that has settled over the country like a thick fog. It’s hard to see where the art and commercialism and spectacle of N.Y.F.W. fits into all that. Designers themselves have struggled with that question since the 2016 election, as have many creators in other fields. The world looks different now than it did even last February, and it will somersault a thousand more times before the clothing parade gears again up next February. (But, make no mistake, the parade will go on.)

But that’s not even it, really, Carrey said. “It’s not our world. We don’t matter. That’s the good news.” Great!
",0
1559,"=- Jacob Barnett
                                                                                                                                                                                                                                                                Username: JacobBarnett52698",0
836,"""  And I never got a chance to """"State my Case"""", since your little friend blocked me before I even had the chance to defend myself.  And now I'm permantly blocked because of your lies.  Don't you dare threaten me anymore or tell me to be civil, because I've been nothing but civil towards you, and you've been horrible in return.""",1
1570,"""

I posted a thread about Donny on WP:ANI  on Saturday after he 1) accused me of WP:BITE and then 2) demanded checkuser to clear his name.  I thought that took some nerve, since I haven't run across any newbies who were so conversant with checkuser, but checkuser isn't employed to establish innocence.  In any case, a passing checkuser confirmed that Donny evaded 3RR using IP's.  Whether or not the IP that raised the Iberian/Arabian issue was Donny is probably beside the point - there's no possibility of AGF with Donny anymore.  You've seen FisherQueen's warning, and I agree with her strategy - that comment isn't quite worthy of blocking, but ignoring her warning will be.   (talk) 

By the way, I will be away on vacation - in Wyoming/Montana in fact - later this month for ten days or so.  I have no intention of being anywhere near a computer.  There will be a few folks (including admins) watching my user/talk pages in case of trouble, and I'll suggest they keep an eye on horse-related articles as well.   (talk) """,0
2689,"'Please make babies!' Fans go into overdrive as they beg Prince Harry to DATE Rihanna after the pair meet in Barbados (but what about Meghan?)

Prince Harry, 32, met Rihanna this week during a visit to Barbados 
Pair were pictured laughing and joking together at a special concert 
Songstress was seen teasing Harry when they volunteered for HIV tests
Fans on social media have called for them to start dating and 'have babies'
Harry is dating Meghan Markle while Rihanna is rumoured to be single 


They locked eyes for the first time just two days ago, but fans are already angling for Prince Harry and Rihanna to get together.

Harry, who is dating Suits actress Meghan Markle, joined forces with the Bajan beauty in Barbados this week as part of his 15-day tour of the Caribbean, and the pair were pictured laughing and joking together.

Within minutes of the images appearing online, fans had taken to Instagram to remark on the couple's chemistry and beg them to become a couple.

As well as teaming up for a series of celebratory events to mark the country's 50th anniversary of independence, the pair both volunteered for HIV tests to highlight World Aids Day yesterday.

And fans could barely contain their excitement, with a video of the pair posted online notching up almost 23,000 likes and hundreds of comments.

Instagrammer belledbel wrote: 'Please make babies,' while katytaylor added, 'I know harry is already dating a wonderfully beautiful girl but how about this for a perfect couple!'

Others commented on the 'cute' pairing with courtleigh8 calling them a 'match made in heaven'.

Rihanna, 28, is rumoured to be newly-single after splitting from Canadian rapper and on-off boyfriend Drake, while Harry is well and truly taken.

Commenting beneath a video of the pair together on Kensington Palace's Instagram page, rieyelisa wrote: 'Ummm yes I fully support this union.'

Mallies went as far as saying they'd make 'the cutest babies' with adore_echelon gushing: 'You guys look stunning together oh my goshh.'

One fan declared she would be 'OK if they dated' while Pakittyy remarked: 'RiRi Royalty!'

However not everyone was convinced, with twittyj blasting: 'RiRi & Harry together? No thanks. She's a very talented lady, but not quite princess material. Pop princess, perhaps.'

Mallies went as far as saying they'd make 'the cutest babies' with adore_echelon gushing: 'You guys look stunning together oh my goshh.'

One fan declared she would be 'OK if they dated' while Pakittyy remarked: 'RiRi Royalty!'

However not everyone was convinced, with twittyj blasting: 'RiRi & Harry together? No thanks. She's a very talented lady, but not quite princess material. Pop princess, perhaps.'

Harry met the songstress for the first time on Wednesday and it seems the pair became fast friends as, following their meet in the afternoon, enjoyed an evening at a concert together.

Rihanna joined the royal for a Golden Anniversary Spectacular Mega Concert at the Kensington Oval Cricket Ground the following evening.

Their visit marked the royal's tenth day of his two week official visit to the Caribbean.

With his visit to Barbados coming to an end Harry looked determined to make the most of his evening with the Diamonds singer.

The royal looked dapper in a pair of wine coloured chinos which he paired with a navy shirt for the event.

Harry is nearing the end of his 15-day tour of the Caribbean which has so far taken him to St Kitt's and Nevis, Grenada and St Lucia. He will finish in Guyana with a special visit to the country's President David Granger.
",0
2147,"spider 

Out of curiosity, do you plan on working on individual spider species or Mygalomorphae?",0
474,AHS TO SAY! I DON'T CARE IF YOUR A MODERATOR A MEMBER OR THE FUCKINGL ORD JESUS CHRIST HIMSELF! I MAKE MY OWN DESCISIONS AND DO WHAT I WANT WHEN I WANT! AND NO ONE IS GOING TO STOP ME!,1
674,"Ian Watkins==
It's a realible source. It's a fansite. These people dedicates there lives for these celeberties. Sorry for som incorrect bitch. FUCK YOU. Answeare me ass quick as possible

==",1
723,WHO CARES.... GOETHEAN IS A capuchin monkeys anyway,1
1190,"""

I don't mind """"merciless editing"""" or """"redistribution""""—it's deletion by idiots that bothers me.  Don't misunderstand me: my earlier statement was no ultimatum.  I will discuss my experiences on WP either way, and in any case there is no going back: I now know that that power-infatuated admins will delete without discussion, and I don't care to try my luck.  Your threat to """"show me the door"""" is ludicrous.  (1) You have no basis—you're just being a dick.  (Not that that would stop you).  (2) What do I care?  I don't benefit from my contributions.  If the royal you doesn't want my help, you can go fuck yourselves.  Ciao. - """,1
387,"""
Feck off, you waste of time.  talk """,1
86,I've requested a change to Wolfpuss - congratulations to all dirty thinkers in our community. (!) I submit to your naughtiness.,1
2831,"Ariel Winter Celebrates One-Year Anniversary With Boyfriend Levi Meaden

Ariel Winter celebrated her one-year anniversary with boyfriend Levi Meaden on Sunday, November 12, posting a sweet love note on Instagram.

“Happy 1 year anniversary my love,” she captioned two pics with her beau. “I’m the luckiest girl in the entire world. Thank you for being the incredible man you are, and for making me the happiest I could’ve ever imagined. Here’s to many, many more. I love you. P.S. your crazy butt is the only one who could ever make me agree to jumping off a cliff at a waterfall soooo yeah. I love you.”

Happy 1 year anniversary my love. I’m the luckiest girl in the entire world. Thank you for being the incredible man you are, and for making me the happiest I could’ve ever imagined. Here’s to many, many more. I love you. ❤️ P.S. your crazy butt is the only one who could ever make me agree to jumping off a cliff at a waterfall soooo yeah. I love you.

The first pic showed them in their red carpet finest, while the second photo featured her in a pink bikini with her legs wrapped around Meaden, 30, as they kissed near a waterfall.

The Aftermath star posted his own tribute to the Modern Family actress, 19, writing, “I can’t believe it’s been a year. We’ve had adventures. Gotten dolled up countless times. And traveled through 3 continents together. I never imagined I’d be this happy. I love you more than anything! Happy anniversary Peanut Butter!!!!”

Earlier this week Winter dished to Us Weekly about Meaden, saying that they “have a great relationship.”

“He’s just the loveliest person, he loves me through thick and thin,” she told Us. “He’s always telling me, no matter what I’m wearing, no matter what I’m doing, that I’m beautiful.”

The couple live together in L.A. in a house that Winter bought last year.

“My boyfriend and I live together, and he cooks,” she told Jimmy Kimmel this past May. “I can’t cook at all. He takes care of all that handy stuff. He’s great, he does all that. I can bake a pie occasionally. Pumpkin and apple. I baked those two the other day. They were edible.”

",0
1430,"""

One of the things on my wishlist is to automatically create maps and title coordinates using the """"lat"""" and """"long"""" fields in the French infobox. But that's for later. BTW once you've added an infobox you need to check the links in it, for instance in the Saint-Pierre-d'Entremont the link to the arrondissement is broken (just fixed it). That takes time, so I'll finish the stubs first. Actually, what I do is add the ones others have missed.  Talk """,0
1306,"Vince - FYI 'Yellowfrogs' is (Longdendale) Councillor Sean Parker Perry, a frequent purveyor of 'Greenwash' and four square behind the destruction of Swallows Wood via his support for the bypass. He is vigourously re-editing the wikpedia pages on the Longdendale Bypass, his own and Roy Oldham's page in order to boost his fake 'green' credentials and obfuscate the neutrality of these articles. He gets nasty if he gets pissed off (threatens spurious legal action), but fortunately, he's legally illiterate, so don't be put off.",0
2271,"""
If I get a chance, I'll upload a shot of the 1994 Indy 500/Brickyard 400 bug, since it was the """"first."""" I have that availible. I can also put some other sports ones up as well.  """,0
2361,"""
I am coming late to this but I am unaware of any Muslim group that rejects Khadija as the first convert. The story of Muhammad's reception of the first revelation and his immediate flight in terror to hide weeping beneath Khadija's robe is a beloved tradition. While the authenticity of the many ahaadith is debated, this event is considered a crucial part of his revelation. I think the introduction """"According to Muslim traditions"""" perfectly suits this situation, given that the event is only recorded by Muslims.

I would be interested if anyone knows of a competing tradition, because admittedly this is not my speciality.

Also, Happy Mevlüt to y'all. '''''' smash! """,0
184,"Your hypocrisy amuses me. 

Look at your userpage. It has webhost written all over it. If i had to lose mine, which i might add, was of religious value to me, then you must certainly have to remove yours. Take a look at User Guinnog for example. This also has webhost written all over it. I put it to you, you elitist, authoritarian administrator, that your userpage is not in line with the goals of wikipedia.

What do i have to do to become an admin? I'm told I'd be a great addition to 'the team'. 

Many Spanks...sorry...thanks, (Percy Nobby Norton got to the keyboard again)..",1
1286,"""

 Yobot: incorrect DEFAULTSORT 

Hi, Yobot  an incorrect DEFAULTSORT. It's puzzling as to why it didn't recognize the article as being about a person. Among other clues, it included birth and death dates at the top, as well as a  (which Yobot substituted to additionally include the correct DEFAULTSORT).  • XAЯAbИAM """,0
1933,"By the way I would like to point out Nick made a mistake in his own original lyrics in this performance'

which should say - My GOOD hand tattooed EVIL across his Brothers fist and those filthy five did nothing to challenge or resist.

So you can hopefully now understand - when he says - My killing hand called EVIL bears a wedding band that's good it has been a long suffering shackle collaring my REBEL BLOOD.",0
208,"Best Player in the NBA 

Rashard Lewis, if you don't agree fuck you.",1
1755,"I took a look at his edits, and he's been back since the 4th. So far only two of his edits have been about the adult scene: the Jenna Jameson article, and the Joey Yale article. The first you knew about, the second was his classic link removal job and had already been reverted. All his other edits have been to sundry athlete articles, where he seems to be adding details about their high school years which is okay by my book...",0
1884,"""

STOP!! The interwiki tags are the difference. Have you even looked on the other wikipedia and even considered wikipedia would be better off having the article in English?? .♦ Dr. Blofeld """,0
1373,"Well, Arthur, I have printed the paper, and the condition is in fact what Ultra.Power says it is, not your correction. It seems that the paper is not incorrect, but rather correct and pointless.

You have already identified the worst problem: The third condition requires incontinuity of f at all integer values. However, this problem disappears if we consider only the special case a=e. So let's do that.

We want a function f satisfying f(1)=e and f(n+1)=exp(f(n)), defined as widely as possible. We observe that n=0 and n=1 present no problems: f(0)=1 and f(-1)=0.

To extend f to all positive real numbers, it is clearly sufficient to define f on an interval of length 1, such as [0,1).

And we want f to be continuously differentiable. (The paper only requires f to be continuously differentiable on (0,1), or equivalently on (-1,0). This is obviously whacky, but we needn't worry about this because a=e.)

Next, for no obvious (or explained) reason we require that f ' is monotone on the interval [0,1]. From the functional equation f(x) = ln f(x+1) we get f '(x) = f '(x+1)/f(x+1). Hence f '(-1)=f '(0)/f(0)=f '(0), so f ' must be constant on [0,1]! 

Not too surprisingly, the function we get in this way is patched together from smaller pieces in a relatively unnatural way: f(x) = exp[x](exp(x-[x])).

Thus what I learned from the paper is that the correct solution to the problem probably has a minimum of its derivative between -1 and 0.",0
1745,"""

 requesting your thought 

Talk:Karen Gillan """"Lady Godiva incident"""" I would like for you to weigh in on whether or not it should be added. Thanks   """,0
157,"Jog on Hitler, nobody wants to hear from you.",1
1001,"Hey everybody, FYI, don't bother posting on Scalzi's website. He deletes posts critical of himself, and he'll do it over and over. That guy he describes on his bio is pretty much the opposite of him: he hates confrontation except on his own terms, and can't handle criticism. In fact he will go to great lengths to hide it from others, all that crap about liking to argue is pretty ridiculous. The only thing that's true about that page is probably that he does indeed taunt people, however he seems to have a problem handling the type of shit he dishes out. So stick to his page here, where at least the facts aren't relative to Scalzi's ego.",1
904,"""

 hello Dick Head 

you are my new friend for life.  — Preceding unsigned comment added by 14.2.185.89   """,1
2081,"Here is the diff. Well, since you always use bare URLs and you never bother to include information about the source, you'll have to forgive me for thinking that was a excerpt from Hoppe himself since you have claimed so often in the past it was OK to use them. I see now that the fact that David Gordon is writer and editor is in tiny letters on top. Now its worthwhile investigating your interpretation. I just have to remind myself to quadruple check all your bare URLs and ask you if that is what you meant to ref, I guess. '' - talkie talkie🗽",0
461,"""

I think all of you americans you have a real attitude and mental problem !TAB
First you live in a World full of conspiracy and spyies . You STILL believe that America won Vietnam, that YOU (especially you) are a Americqan soldier hero ....pffff...TAB
Anyway no need to show  you more proves of how crazy and idiots americans are - by the way ...what happend in Ferguson ? Is """"American democracy"""" ? a ? THE Cowboy LAW ! All you you a bunch of stupid, incredible stupid cowboys !!!TAB
One guy enter in a shop, he molest the cashier, still some products, push away the employee and YOU...AMERICANS ...what you do ?TAB
You go in the street screaming - wasn't his  fault !TAB
You are a JOKE OF people !
A bunch of iditos !
But anyway, from my point of view ...keep thinking and acting like this.Alredy the whole Europe, Asia and in specially Russia DON'T like you at all !
You will end up of being the """"paria"""" of World ! -IF you know what that means !
It seems that what i was trying to explain to you was just something for a american military idiot who thinks he is STILL in 'Nam ! TAB
I'm doing contributions to many articles you dumb stupid fag from ALL OVER THE WORLD because i travel a lot with my work and in my free time i try to do something USEFUL !!!!!
You stupid piece of shit !TAB
You can do WHATEVER YOU WANT because I DON'T CARE  !!! I DO NOT sympathize with ANY publication, news, website, so I DON'T CARE ! And as long as i edit article, by ADDING USEFUL info's from a lot of different IP's ll over the world, what you will do ? BLOCK them ALL ? !
You stupid dumb !
You cannot take my opinion away !
And as i travel, i will continue to DEVELOP AND SUPPORT Wikipedia NOT with ....stupid accusations !
So SHUT UP and keep dreaming on the American way !TAB
Ok ?

Aaaa...so why is that when he is """"dreaming"""" on conspiracy"""" and is ACCUSING me  that i'm doing SPAM ??? And laughing like a little perp about """"shooting myself in the foot"""" and """"boomerang"""" ??? What the hell is this ? Why he is making accusations ? Aaaaa...i forgot ! Upssss...he IS AN AMERICAN !!!! And ALLL AMERICANS have """"the right"""" to do WHATEVER  THEY WANT in the WHOLE WORLD  no ?
Invading other countries, CLAIMING that ...aaaaa...ups ...Ukraine was defenseless ...Syria the same ..now Bagdad again ... C\mon on ! Let's do on Wikipedia THE SAME NO ???

If  - as i mentioned before - i use MANY IP's while travelling, i edit from different IP's and one user i was using it just from time to time like this one and IT HAPPEN that i was REMOVING and ADDING some links from some pages where i read DIFFERENT Info's related with THAT wiki article, WHY HE IS SO IDIOT and makes  accusations ?!
And then EXACTLY like a ... american cowboy is """"hunting me"""" and accusing that i'm using IN THE SAME TIME another IP ????
Is he CRAZY ?
Why only him is making accusations and IS OK ?
IF HE continue like this I WILL make complains and report abuse and send to dispute and admins !
I also have my rights no ?

TELL HIM TO STOP playing like a stupid child and STOP accusations, and i will mind my way !""",1
171,"Fuck you, Smith.  Please have me notified when you die.  I want to dance on your grave.",1
2299,"""

 Lack of Follow-Up by User:Ktr101|Kevin Rutherford on deletion made 26 November 2011 - is confirmed VANDALISM by lack of response after 97 days. 

Mr. Rutherford has made no attempt to answer here about his deletion of sourced content whose veracity is as strong or stronger than what User:Mikenorton (above) assesses as 'reliable sources' (i.e. Orey, Cal (2006) book as source material.) [gleefully he wrote above: """"That's much better - I can actually see the wood for the trees now.""""]  In addition, by implication User:Mikenorton is implying that wikipedia articles themselves are unreliable (as sources).  This is evidence for censorship by User:Mikenorton as well.  If you want to be taken seriously User:Mikenorton I suggest you read and comprehend the deleted material before spouting """"misrepresenatations of fact"""" about the deleted material.""",0
967,"Please keep your whining off my talk page, KTHXBI.",1
2044,"I just did a re-read of Murder Machine, and it says that Katz got off three shots at Rosenberg - one shot hit his jaw, a second shot hit his arm, and a third shot grazed his chest.",0
2323,"Correction! Got it wrong, the above website is an attack on the Jesus Seminar.",0
1471,"""
 Sammy 
I added the referenced fact the bin Laden was known as """"Sammy"""" in his youth. I accept that it might seem like vandalism that the arch super villain had a semi-westernised childhood, but this is an encyclopedic fact. I believe my original edit should be reinstated.   """,0
81,"""

 Barbarians 

The Chinese as a country are nothing but disgusting barbarians. I highly recommend every and all Chinese people to flee the horrors of the CCP before they come for YOU next! Its now official, over 20,000 Falun Gong have been murdered in this genocide but the official numbers are not certain due to the """"iron curtain"""" around China. We haven't seen such destruction and genocide since the Soviet Union! Those damn Chinese. I feel bad for the Falun Gong. I hope every CCP dies of a horrible skin disease.""",1
2400,"""
Which is why I keep asking you to get WP:Autoreviewer. By the way, why did you change the spelling of Shadowbrook?—Spiff """,0
2284,"Misleading Intro 

First sentence: Czechoslovakia (Czech: Československo, Slovak: Česko-Slovensko/before 1990 Československo)
Isn't it strange? From this I understand, that name Česko-Slovensko was oficial name 1990-92 only in  Slovak/ia, but it was oficial name of whole Czechoslovakia. I'd propose following sentence:
Czechoslovakia (Czech, Slovak: Československo, after 1990 Česko-Slovensko)",0
2328,I agree with Autospark.,0
1953,"I want to say that Berksguy is the one that is the kook.  He acts as if I am the one causing all of this.  When I do edits I use my login.  I'm not ashamed to back my views and put my name next to them.  However Berksguy needs to realise that other people out there feel the same way, and it is rather silly to think that every user that posts something that does not fit his agenda is me.  I do however believe that all of the actions of Mayor McMahon should be displayed good or bad if sourced and that includes his crazy words about supporting Illegal Aliens as was sourced.  George W. Bush, Robert Byrd, etc. have tons of sourced actions both good and bad toward those persons, and the same standard should apply to Tom McMahon. (}",0
656,"Now that Specifico has chimed in with the usual bullshit, it is time to close this discussion.  –",1
476,So he forgot to change his signature. Don't go around telling people what their religions are you anti-Islamic zealots.,1
